Name,Varietal,Region,Price,Dosage,Online_Rating,Total_Ratings,sommelier_ratings
Domaine de la Janasse Principaute d'Orange Viognier 2020,Viognier,"Rhone, France",24 99,750 ML,3.5,7 Ratings,
Pirouette 2017,Bordeaux Red Blends,"Columbia Valley, Washington",64 99,750 ML,3.6,8 Ratings,JD 96 RP 94 JS 93
FitVine Wine Sauvignon Blanc 2019,Sauvignon Blanc,California,18,750 ML,3.7,9 Ratings,
Kevin Zraly's One Hour French Red Wine Expert Tasting Kit,,,89 99,750 ML,0.0,0 Ratings,
Lieu Dit Melon de Bourgogne 2021,Melon de Bourgogne,"Santa Maria Valley, Central Coast, California",24 99,750 ML,4.5,5 Ratings,
Darms Lane Bon Passe Vineyard Cabernet Sauvignon 2015,Cabernet Sauvignon,"Napa Valley, California",67 99,750 ML,0.0,0 Ratings,
Ken Forrester Reserve Sauvignon Blanc 2016,Sauvignon Blanc,"Stellenbosch, South Africa",21 99,750 ML,3.8,20 Ratings,JS 90
The Paring Chardonnay 2018,Chardonnay,"Santa Barbara, Central Coast, California",24 99,750 ML,0.0,0 Ratings,JD 90
Rotem & Mounir Saouma Chateauneuf-du-Pape Arioso 2015,Grenache,"Chateauneuf-du-Pape, Rhone, France",229 99,750 ML,0.0,0 Ratings,WS 98 JD 97 D 97
Gulp Hablo White (1 Liter) 2020,Verdejo,"La Mancha, Spain",15 99,1000 ML,4.1,8 Ratings,
Laurent-Perrier Grand Siecle No. 17 Les Reserves (1.5 Liter Magnum),Non-Vintage Sparkling Wine,"Champagne, France","1,499 99",1500 ML,0.0,0 Ratings,JS 99 D 97 V 95
Domaine Marquis d'Angerville Volnay Clos des Ducs Premier Cru Monopole 1996,Pinot Noir,"Volnay, Cote de Beaune, Cote d'Or, Burgundy, France",339 97,750 ML,0.0,0 Ratings,
Duckhorn Sauvignon Blanc 2021,Sauvignon Blanc,"North Coast, California",25 99,750 ML,4.1,7 Ratings,
Truchard Estate Cabernet Sauvignon 2019,Cabernet Sauvignon,"Carneros, California",39 99,750 ML,0.0,0 Ratings,WW 92
Jean-Claude Boisset Bourgogne Hautes-Cotes de Nuits Blanc 2018,Chardonnay,"Cote de Nuits, Cote d'Or, Burgundy, France",37 99,750 ML,0.0,0 Ratings,
Stack House Cabernet Sauvignon 2018,Cabernet Sauvignon,"Napa Valley, California",34 99,750 ML,0.0,0 Ratings,JD 91
Lieu Dit Cabernet Franc Sans Soufre 2020,Cabernet Franc,"Santa Ynez Valley, Santa Barbara, Central Coast, California",30 99,750 ML,0.0,0 Ratings,V 93
Naturalis Cabernet Sauvignon 2019,Cabernet Sauvignon,"South Australia, Australia",13 99,750 ML,3.9,5 Ratings,TP 90
Familia Torres Celeste Verdejo Sur Lies 2019,Verdejo,"Rueda, Spain",17 99,750 ML,0.0,0 Ratings,
Portalupi Arneis 2021,Arneis,"Mendocino, California",27 99,750 ML,0.0,0 Ratings,
Chateau de Plaisance Anjou Grand Lopin Rouge 2019,Bordeaux Red Blends,"Anjou, Loire, France",45 99,750 ML,0.0,0 Ratings,
Aquinas Cabernet Sauvignon 2018,Cabernet Sauvignon,"North Coast, California",17 99,750 ML,0.0,0 Ratings,
Casas del Bosque Reserva Cabernet Sauvignon 2019,Cabernet Sauvignon,"Rapel Valley, Chile",14 99,750 ML,0.0,0 Ratings,
Ao Yun Shangri-La 2016,Bordeaux Red Blends,China,299 99,750 ML,0.0,0 Ratings,JS 96
Tilia Merlot 2020,Merlot,"Mendoza, Argentina",11 99,750 ML,0.0,0 Ratings,
Domaine Henri Prudhon Chassagne-Montrachet Les Chambres Rouge 2017,Pinot Noir,"Chassagne-Montrachet, Cote de Beaune, Cote d'Or, Burgundy, France",55 99,750 ML,0.0,0 Ratings,
TerraNoble Sauvignon Blanc 2020,Sauvignon Blanc,"Casablanca Valley, Chile",12 99,750 ML,0.0,0 Ratings,
Bodega Benegas Benegas Lynch Malbec 2017,Malbec,"Mendoza, Argentina",78 99,750 ML,0.0,0 Ratings,
Paxton Vineyards AAA Shiraz Grenache 2020,Rhone Red Blends,"McLaren Vale, South Australia, Australia",21 99,750 ML,0.0,0 Ratings,
Faust Cabernet Sauvignon (1.5 Liter Magnum) 2019,Cabernet Sauvignon,"Napa Valley, California",125 99,1500 ML,0.0,0 Ratings,JS 95 WS 93
Yealands Estate Single Vineyard Sauvignon Blanc 2021,Sauvignon Blanc,"Marlborough, New Zealand",24,750 ML,4.1,11 Ratings,WW 91
Catena Appellation La Consulta Malbec 2019,Malbec,"Mendoza, Argentina",24 99,750 ML,4.1,14 Ratings,
Pax North Coast Syrah 2020,Syrah/Shiraz,"North Coast, California",35 99,750 ML,0.0,0 Ratings,
Quinta do Casal do Ramilo White 2016,Other White Blends,Portugal,14 98,750 ML,0.0,0 Ratings,
Rene Rostaing Cote-Rotie La Viaillere 1995,Rhone Red Blends,"Cote Rotie, Rhone, France",155 99,750 ML,0.0,0 Ratings,RP 90
R. Lopez de Heredia Vina Bosconia Reserva 2009,Tempranillo,"Rioja, Spain",46 99,750 ML,4.0,9 Ratings,JS 96 RP 92 W & S 92
Field Recordings PPP Paso Piquette Project 2020,Other Red Blends,"Paso Robles, Central Coast, California",19 99,750 ML,3.7,7 Ratings,WW 91
Viski Stainless Steel Cocktail Shaker,,,44 99,0 ML,0.0,0 Ratings,
Karen MacNeil by Oneida Flavor First Petite Stems (Set of 6),,,59 99,0 ML,0.0,0 Ratings,
Corte Gardoni Custoza Mael 2020,Other White Blends,"Veneto, Italy",19 99,750 ML,0.0,0 Ratings,
Librandi Ciro Greco Bianco 2020,Greco,"Calabria, Italy",13 99,750 ML,0.0,0 Ratings,
Maison Leroy Gevrey-Chambertin 1983,Pinot Noir,"Gevrey-Chambertin, Cote de Nuits, Cote d'Or, Burgundy, France","1,869 99",750 ML,0.0,0 Ratings,
Fontanafredda Gavi di Gavi 2019,Cortese,"Gavi, Piedmont, Italy",26 99,750 ML,3.9,35 Ratings,
Candoni Prosecco,Non-Vintage Sparkling Wine,"Prosecco, Italy",14 99,750 ML,4.2,104 Ratings,
Dry Creek Vineyard Heritage Zinfandel 2019,Zinfandel,"Sonoma County, California",26,750 ML,4.0,143 Ratings,JD 92 WE 92 WW 91 WS 91
Byron Julia's Vineyard Pinot Noir 2016,Pinot Noir,"Santa Maria Valley, Central Coast, California",45,750 ML,0.0,0 Ratings,
Poderi Vaiot Sessantadi Nebbiolo d'Alba 2018,Nebbiolo,"Alba, Piedmont, Italy",19 99,750 ML,0.0,0 Ratings,
90 Point Red Wine & BRIX Chocolate Gift Set,,,85,750 ML,0.0,0 Ratings,
Viticcio Ferraio 2017,Sangiovese,"Tuscany, Italy",14 99,750 ML,0.0,0 Ratings,
District 7 Pinot Noir 2020,Pinot Noir,"Monterey, Central Coast, California",17 99,750 ML,0.0,0 Ratings,
Notorious Wines Infamous Gold Cabernet Blanc 2019,Other White Wine,"Vin de France, France",16 99,750 ML,4.1,17 Ratings,
Ver Sacrum Clarete 2020,Rosé,"Uco Valley, Mendoza, Argentina",16 99,750 ML,0.0,0 Ratings,
Domaine de l'Arlot Nuits-St-Georges Clos de l'Arlot Premier Cru Monopole Blanc 2018,Chardonnay,"Nuits-St-Georges, Cote de Nuits, Cote d'Or, Burgundy, France",159 99,750 ML,0.0,0 Ratings,BH 91 RP 91
Limerick Lane Russian River Zinfandel 2020,Zinfandel,"Russian River, Sonoma County, California",46,750 ML,3.6,6 Ratings,V 91
Calera Central Coast Chardonnay 2018,Chardonnay,"Central Coast, California",20 99,750 ML,3.8,9 Ratings,
Chateau Laplagnotte-Bellevue 2019,Bordeaux Red Blends,"St. Emilion, Bordeaux, France",39 99,750 ML,0.0,0 Ratings,
La Bernarde Cotes de Provence Rose Les Hauts de Luc 2020,Rosé,"Cotes de Provence, Provence, South of France, France",20,750 ML,3.4,10 Ratings,V 90
Louis Martini Monte Rosso Cabernet Sauvignon 2016,Cabernet Sauvignon,"Moon Mountain District, Sonoma Valley, Sonoma County, California",150,750 ML,3.7,8 Ratings,JS 97 RP 95 WE 94
Valravn Cabernet Sauvignon 2019,Cabernet Sauvignon,"Sonoma County, California",24,750 ML,0.0,0 Ratings,TP 92
Ca' del Bosco Franciacorta Cuvee Prestige Extra Brut,Non-Vintage Sparkling Wine,"Lombardy, Italy",50,750 ML,4.3,120 Ratings,WW 93 JS 92 RP 91 WE 90 WS 90
Annabella Napa Valley Cabernet Sauvignon 2020,Cabernet Sauvignon,"Napa Valley, California",19 99,750 ML,0.0,0 Ratings,
Cava Mestres 1312 Cava Reserva Brut,Non-Vintage Sparkling Wine,"Cava, Spain",18 99,750 ML,4.2,16 Ratings,
Chateau Yvonne Saumur-Champigny L'Ile Quatre Sous 2020,Cabernet Franc,"Saumur, Loire, France",25 99,750 ML,0.0,0 Ratings,
Sean Minor Rose of Pinot Noir 2021,Rosé,California,16 99,750 ML,0.0,0 Ratings,
Domaine Perrot-Minot Chambolle-Musigny Les Charmes Vieilles Vignes Premier Cru 2012,Pinot Noir,"Chambolle-Musigny, Cote de Nuits, Cote d'Or, Burgundy, France",229 97,750 ML,0.0,0 Ratings,V 94
Mulassano Extra Dry Vermouth,Vermouth,Italy,31 99,750 ML,0.0,0 Ratings,
Rowen Red Wine 2017,Other Red Blends,"Sonoma County, California",55 99,750 ML,0.0,0 Ratings,WE 90
Cave de Lugny Macon Villages La Cote Blanche 2020,Chardonnay,"Macon Villages, Maconnais, Burgundy, France",15 99,750 ML,0.0,0 Ratings,
Willems-Willems Mosel Riesling Kabinett Feinherb 2020,Riesling,"Mosel, Germany",22 99,750 ML,0.0,0 Ratings,
Geyser Peak Sauvignon Blanc 2019,Sauvignon Blanc,California,10 99,750 ML,3.5,21 Ratings,JS 90
J. Christopher Abbey Ridge Pinot Noir 2015,Pinot Noir,"Dundee Hills, Willamette Valley, Oregon",64 99,750 ML,0.0,0 Ratings,JS 93 WS 93 WE 93
Vina Sastre Crianza 2018,Tempranillo,"Ribera del Duero, Spain",40 99,750 ML,0.0,0 Ratings,
Domaine Roulot Auxey-Duresses Premier Cru Rouge 2012,Pinot Noir,"Auxey-Duresses, Cote de Beaune, Cote d'Or, Burgundy, France",139 99,750 ML,0.0,0 Ratings,
Kumeu River Estate Chardonnay 2020,Chardonnay,New Zealand,33 99,750 ML,3.8,11 Ratings,JS 95
Marc Deschamps Les Champs de Cri Pouilly-Fume 2017,Sauvignon Blanc,"Pouilly-Fume, Loire, France",31 99,750 ML,0.0,0 Ratings,
Cote Bonneville Carriage House Red Blend 2012,Bordeaux Red Blends,"Yakima Valley, Columbia Valley, Washington",50 99,750 ML,0.0,0 Ratings,RP 90
Poppy Cabernet Sauvignon 2019,Cabernet Sauvignon,"Paso Robles, Central Coast, California",14 99,750 ML,0.0,0 Ratings,
Meo-Camuzet Freres & Soeurs Nuits-St-Georges Les Argillas Premier Cru 2019,Pinot Noir,"Nuits-St-Georges, Cote de Nuits, Cote d'Or, Burgundy, France",219 99,750 ML,0.0,0 Ratings,BH 91
Ciacci Piccolomini d'Aragona Rosso di Montalcino 2020,Sangiovese,"Montalcino, Tuscany, Italy",26 99,750 ML,0.0,0 Ratings,
Richard Partridge Cabernet Sauvignon 2000,Cabernet Sauvignon,"Napa Valley, California",79 97,750 ML,0.0,0 Ratings,
Domaine Joseph Roty Charmes-Chambertin Grand Cru 2017,Pinot Noir,"Gevrey-Chambertin, Cote de Nuits, Cote d'Or, Burgundy, France",519 99,750 ML,0.0,0 Ratings,RP 96 BH 94
Cattleya Wines Cuvee Number Five Chardonnay 2019,Chardonnay,"Sonoma Coast, Sonoma County, California",54 99,750 ML,0.0,0 Ratings,WE 95 TP 94
Paul Dolan Vineyards Organically Grown Zinfandel 2019,Zinfandel,"Mendocino, California",25,750 ML,3.9,219 Ratings,WW 90 WE 90
Clay Shannon Betsy Vineyard Sauvignon Blanc 2020,Sauvignon Blanc,"High Valley, Lake County, North Coast, California",17 99,750 ML,0.0,0 Ratings,JS 91 WW 90
Le Ragnaie Ragnaie Vigna Vecchia Brunello di Montalcino 2017,Sangiovese,"Montalcino, Tuscany, Italy",159 99,750 ML,0.0,0 Ratings,RP 95
Bibi Graetz Casamatta Rosso 2019,Sangiovese,"Tuscany, Italy",14 99,750 ML,4.6,28 Ratings,
Domaine de Bernier Chardonnay 2020,Chardonnay,"Loire, France",11 99,750 ML,4.1,12 Ratings,TP 90
Burgo Viejo Palacio del Burgo Reserva 2016,Tempranillo,"Rioja, Spain",21 99,750 ML,0.0,0 Ratings,JS 91 RP 90
Borgogno Dolcetto d'Alba 2020,Dolcetto,"Alba, Piedmont, Italy",23 99,750 ML,0.0,0 Ratings,
DiT Celler Cabirol Tinto 2019,Other Red Blends,"Montsant, Spain",16 99,750 ML,0.0,0 Ratings,
Forgeron Anvil Proprietary Blend Minnick Hills Vineyard 2017,Bordeaux Red Blends,"Columbia Valley, Washington",64 97,750 ML,0.0,0 Ratings,RP 92 WE 92
Backlands Pinot Noir 2014,Pinot Noir,"Mendocino Ridge, Mendocino, California",80,750 ML,0.0,0 Ratings,
Nieto Senetiner Blend Collection 2016,Other Red Blends,"Mendoza, Argentina",16 99,750 ML,3.8,7 Ratings,JS 91
Tamber Bey Deux Chevaux Vineyard Rabicano 2017,Bordeaux Red Blends,"Yountville, Napa Valley, California",69 99,750 ML,0.0,0 Ratings,JS 91
Knights Bridge KB Estate Cabernet Sauvignon 2016,Cabernet Sauvignon,"Knights Valley, Sonoma County, California",59 99,750 ML,0.0,0 Ratings,WW 93
Petrolo Galatrona 2019,Merlot,"Tuscany, Italy",130,750 ML,0.0,0 Ratings,JS 99 WS 97 RP 97 D 95
De Martino Estate Carmenere 2019,Carmenere,Chile,13 99,750 ML,0.0,0 Ratings,
Terre Rouge Tete-a-Tete 2014,Rhone Red Blends,"Sierra Foothills, California",25,750 ML,3.9,22 Ratings,WE 90
Hope Basalt Block Shiraz 2018,Syrah/Shiraz,"Hunter Valley, New South Wales, Australia",16 99,750 ML,4.0,9 Ratings,
Cypress Merlot 2018,Merlot,"Central Coast, California",10 99,750 ML,0.0,0 Ratings,
Lustau Manzanilla Pasada Jurado (500ML),Sherry,Spain,29 99,500 ML,4.3,13 Ratings,WS 92 W & S 92 RP 90
Gagliole Rubiolo Chianti Classico 2019,Sangiovese,"Chianti Classico, Chianti, Tuscany, Italy",18 99,750 ML,0.0,0 Ratings,JS 91
Wayfarer Chardonnay 2019,Chardonnay,"Fort Ross-Seaview, Sonoma Coast, Sonoma County, California",88 99,750 ML,0.0,0 Ratings,JD 97 RP 95 WS 93 JS 93
Schloss Gobelsburg Lamm Gruner Veltliner 2019,Gruner Veltliner,"Kamptal, Austria",78 99,750 ML,0.0,0 Ratings,JS 96 RP 96
Auguste Clape Cornas (1.5 Liter Magnum - bin soiled label) 2000,Syrah/Shiraz,"Cornas, Rhone, France",629 97,1500 ML,0.0,0 Ratings,
Benjamin Romeo Contador 2011,Tempranillo,"Rioja, Spain",400,750 ML,0.0,0 Ratings,RP 96 V 94
Smith & Hook Cabernet Sauvignon 2019,Cabernet Sauvignon,"Central Coast, California",25,750 ML,4.0,113 Ratings,WE 92 W & S 90
Cayuse Wallah Wallah Special #5 (1.5 Liter Magnum) 2013,Syrah/Shiraz,"Walla Walla Valley, Columbia Valley, Washington",299 97,1500 ML,0.0,0 Ratings,RP 96 WE 93 V 93
Maison No. 9 - A Post Malone Project Rose 2020,Rosé,"South of France, France",17 99,750 ML,3.9,38 Ratings,WW 91
Segal's Unfiltered Cabernet Sauvignon (OK Kosher) 2018,Cabernet Sauvignon,Israel,84 99,750 ML,0.0,0 Ratings,
Eberle Cotes-du-Robles Blanc 2019,Rhone White Blends,"Paso Robles, Central Coast, California",26 99,750 ML,0.0,0 Ratings,TP 92 WW 91 WE 90
Domaine Antonin Guyon Gevrey-Chambertin La Justice 2017,Pinot Noir,"Gevrey-Chambertin, Cote de Nuits, Cote d'Or, Burgundy, France",74 99,750 ML,0.0,0 Ratings,WS 93 BH 91 W & S 91
Anne Pichon Sauvage Cuvee Vieilles Vignes Grenache Noir 2018,Grenache,France,18 99,750 ML,0.0,0 Ratings,
La Capranera Paestum Aglianico 2019,Aglianico,"Campania, Italy",15 99,750 ML,0.0,0 Ratings,
Chateau Puy Blanquet 2017,Bordeaux Red Blends,"St. Emilion, Bordeaux, France",37 99,750 ML,0.0,0 Ratings,WS 90
Anthony & Dominic Pinot Noir 2019,Pinot Noir,"North Coast, California",20,750 ML,0.0,0 Ratings,
Clonakilla O'Riada Shiraz 2019,Syrah/Shiraz,"Canberra, New South Wales, Australia",47 99,750 ML,0.0,0 Ratings,
David & Nadia Chenin Blanc 2020,Chenin Blanc,"Swartland, South Africa",37 99,750 ML,0.0,0 Ratings,JS 93
FEL Anderson Valley Chardonnay 2018,Chardonnay,"Anderson Valley, Mendocino, California",32 99,750 ML,0.0,0 Ratings,WE 92
Foxen 7200 Vogelzang Vineyard Cabernet Sauvignon 2017,Cabernet Sauvignon,"Happy Canyon, Santa Barbara, Central Coast, California",57 99,750 ML,0.0,0 Ratings,JD 93 TP 93 WE 92
Ghost Pines Winemaker's Blend Pinot Noir 2016,Pinot Noir,California,23,750 ML,3.3,25 Ratings,WS 90
Sonoma-Cutrer Russian River Valley Pinot Noir 2019,Pinot Noir,"Russian River, Sonoma County, California",32 99,750 ML,0.0,0 Ratings,
Gaja Sori San Lorenzo 2007,Nebbiolo,"Piedmont, Italy",479 97,750 ML,0.0,0 Ratings,WE 99 JS 99 RP 98 WS 97
Domaine Henri Prudhon St-Aubin Sur Le Sentier du Clou Premier Cru Rouge 2017,Pinot Noir,"St-Aubin, Cote de Beaune, Cote d'Or, Burgundy, France",45 99,750 ML,0.0,0 Ratings,
Domaine Joseph Voillot Volnay Vieilles Vignes 2005,Pinot Noir,"Volnay, Cote de Beaune, Cote d'Or, Burgundy, France",79 97,750 ML,0.0,0 Ratings,
Chateau Leoville Poyferre 2003,Bordeaux Red Blends,"St-Julien, Bordeaux, France",199 97,750 ML,4.7,7 Ratings,RP 96 WS 95 JS 95 WE 93
Willems-Willems Altenberg Riesling Kabinett 2020,Riesling,"Mosel, Germany",24 99,750 ML,0.0,0 Ratings,
Courbis Saint-Joseph Les Royes 2019,Syrah/Shiraz,"Saint-Joseph, Rhone, France",57 99,750 ML,0.0,0 Ratings,V 93 RP 93
Shenandoah Sauvignon Blanc 2020,Sauvignon Blanc,California,12,750 ML,0.0,0 Ratings,
Tour Saint Christophe 2018,Bordeaux Red Blends,"St. Emilion, Bordeaux, France",44 99,750 ML,4.2,72 Ratings,JS 97 V 95 JD 95 RP 94 D 90
Remoissenet Puligny-Montrachet 2019,Chardonnay,"Puligny-Montrachet, Cote de Beaune, Cote d'Or, Burgundy, France",119 99,750 ML,0.0,0 Ratings,WW 94
Colgin IX Estate Syrah 2014,Syrah/Shiraz,"Napa Valley, California",309 97,750 ML,0.0,0 Ratings,RP 95 WS 94
Cadence Cara Mia Vineyard Camerata 2018,Bordeaux Red Blends,"Red Mountain, Yakima Valley, Columbia Valley, Washington",59 99,750 ML,0.0,0 Ratings,RP 94 W & S 93 WE 92
Bisol Jeio Prosecco Brut,Non-Vintage Sparkling Wine,"Prosecco, Italy",15 99,750 ML,4.3,201 Ratings,JS 90
Frank Family Vineyards Chardonnay (375ML half-bottle) 2019,Chardonnay,"Carneros, California",19 99,375 ML,0.0,0 Ratings,JD 90
Old Soul Vineyards Chardonnay 2020,Chardonnay,"Lodi, California",16,750 ML,0.0,0 Ratings,WE 90 TP 89
Chateau de Rouanne Les Cotes Vinsobres 2019,Rhone Red Blends,"Vinsobres, Rhone, France",75,750 ML,0.0,0 Ratings,WS 93
Carmel Road Monterey Chardonnay 2020,Chardonnay,"Monterey, Central Coast, California",13 99,750 ML,0.0,0 Ratings,
Domaine du Vieux Telegraphe Chateauneuf-du-Pape La Crau 1996,Rhone Red Blends,"Chateauneuf-du-Pape, Rhone, France",145 97,750 ML,0.0,0 Ratings,
Chateau Pape Clement (Futures Pre-Sale) 2020,Bordeaux Red Blends,"Pessac-Leognan, Bordeaux, France",94 97,750 ML,0.0,0 Ratings,JD 99 RP 98 JS 97 WE 96 D 94
Infine 1939 At Last Cuvee Bianco 2018,Other White Blends,"Trentino, Trentino-Alto Adige, Italy",61 99,750 ML,0.0,0 Ratings,
Chateau Coupe Roses Fremillant Rose 2020,Rosé,"Minervois, Languedoc, South of France, France",18 99,750 ML,0.0,0 Ratings,
Olivier Bernstein Mazis-Chambertin Grand Cru 2011,Pinot Noir,"Gevrey-Chambertin, Cote de Nuits, Cote d'Or, Burgundy, France",519 99,750 ML,0.0,0 Ratings,V 95 BH 95
Ferrari Perle Nero 2010,Vintage Sparkling Wine,"Trentino, Trentino-Alto Adige, Italy",83 99,750 ML,0.0,0 Ratings,WE 95 RP 95 WS 91
El Enemigo Semillon 2018,Semillon,"Mendoza, Argentina",28,750 ML,3.9,19 Ratings,JS 95
Pasqua Romeo and Juliet Passimento Bianco 2019,Garganega,"Veneto, Italy",18 99,750 ML,0.0,0 Ratings,JS 89
Herdade Do Esporao Private Selection Branco 2017,Semillon,"Alentejo, Portugal",45,750 ML,3.8,8 Ratings,WE 92 WS 91
Chateau de Plaisance Savennieres 2020,Chenin Blanc,"Anjou, Loire, France",57 99,750 ML,0.0,0 Ratings,
Axios Cabernet Sauvignon 2015,Cabernet Sauvignon,"Napa Valley, California",150,750 ML,0.0,0 Ratings,
Napa Cellars Sauvignon Blanc 2020,Sauvignon Blanc,"Napa Valley, California",18 99,750 ML,0.0,0 Ratings,
Daniel Largeot Chorey-les-Beaune Les Beaumonts 2017,Pinot Noir,"Chorey-les-Beaune, Cote de Beaune, Cote d'Or, Burgundy, France",37 98,750 ML,0.0,0 Ratings,
Skylark Las Aves 2015,Other Red Blends,"North Coast, California",29 99,750 ML,0.0,0 Ratings,
Zardetto Prosecco Brut,Non-Vintage Sparkling Wine,"Prosecco, Italy",15,750 ML,3.8,153 Ratings,JS 90
Domaine Michel Gros Hautes Cotes de Nuits Fontaine St. Martin Monopole Blanc 2018,Chardonnay,"Hautes Cotes de Nuits, Cote de Beaune, Cote d'Or, Burgundy, France",45 99,750 ML,0.0,0 Ratings,
Cave de Ribeauville Cremant d'Alsace Brut Rose Le Comte,Sparkling Rosé,"Alsace, France",24,750 ML,4.3,9 Ratings,WE 90
Vina Robles The Arborist 2019,Other Red Blends,"Paso Robles, Central Coast, California",20,750 ML,3.9,22 Ratings,WE 93
Rene Rostaing Cote-Rotie La Landonne 1998,Syrah/Shiraz,"Cote Rotie, Rhone, France",469 97,750 ML,0.0,0 Ratings,WS 94 RP 93
Domaine Olivier Cuvee du Mont des Oliviers 2018,Cabernet Franc,"Loire, France",21 99,750 ML,0.0,0 Ratings,
Chateau Simone Palette Blanc 2015,Other White Blends,"Provence, South of France, France",67 99,750 ML,0.0,0 Ratings,
Chateau Grand-Puy-Lacoste (1.5 Liter Magnum) 2018,Bordeaux Red Blends,"Pauillac, Bordeaux, France",169 99,1500 ML,0.0,0 Ratings,WS 95 D 95 V 95 JS 94 JD 94 RP 93 WE 92
Melanie Pfister Engelberg Riesling Grand Cru 2017,Other White Blends,"Alsace, France",47 99,750 ML,0.0,0 Ratings,WE 94
Mark Haisma Gevrey-Chambertin 2016,Pinot Noir,"Gevrey-Chambertin, Cote de Nuits, Cote d'Or, Burgundy, France",97 99,750 ML,0.0,0 Ratings,RP 92
Chateau Montrose (Futures Pre-Sale) 2020,Bordeaux Red Blends,"St. Estephe, Bordeaux, France",189 97,750 ML,0.0,0 Ratings,D 98
Domaine Lafage Tessellae Old Vines Carignan 2018,Carignan,"Côtes du Roussillon, Roussillon, South of France, France",16 99,750 ML,3.5,14 Ratings,JD 90
Luigi Pira Barolo Margheria 2017,Nebbiolo,"Barolo, Piedmont, Italy",54 99,750 ML,0.0,0 Ratings,JS 95 JD 94 RP 92
Filippo Grasso Ripiddu Etna Rosso 2018,Nerello Mascalese,"Sicily, Italy",36 99,750 ML,0.0,0 Ratings,
Tablelands Marlborough Pinot Noir 2016,Pinot Noir,"Marlborough, New Zealand",19 99,750 ML,3.8,5 Ratings,
Charles Smith Wines Velvet Devil Merlot 2019,Merlot,Washington,11 99,750 ML,0.0,0 Ratings,
David Renaud Irancy 2017,Pinot Noir,"Burgundy, France",39 99,750 ML,0.0,0 Ratings,
Pine Ridge Napa Cabernet Sauvignon 2019,Cabernet Sauvignon,"Napa Valley, California",65,750 ML,4.0,5 Ratings,
Bouchard Pere & Fils Meursault (Domaine) 2017,Chardonnay,"Meursault, Cote de Beaune, Cote d'Or, Burgundy, France",78 99,750 ML,0.0,0 Ratings,WW 91
Browne Family Vineyards Cabernet Sauvignon 2019,Cabernet Sauvignon,"Columbia Valley, Washington",31 99,750 ML,3.6,10 Ratings,WW 90
Domaine des Lambrays Morey-St-Denis 2019,Pinot Noir,"Morey-St-Denis, Cote de Nuits, Cote d'Or, Burgundy, France",129 99,750 ML,0.0,0 Ratings,D 92 RP 91 BH 90
Domaine de Marcoux Cotes-du-Rhone 2018,Rhone Red Blends,"Cotes du Rhone, Rhone, France",28 99,750 ML,3.4,5 Ratings,
Monocle Cabernet Sauvignon 2012,Cabernet Sauvignon,"Napa Valley, California",279 97,750 ML,0.0,0 Ratings,
Les Jamelles Viognier 2019,Viognier,"Pays d’Oc, South of France, France",15 99,750 ML,0.0,0 Ratings,TP 91
Mas Martinet Els Escurcons 2018,Grenache,"Priorat, Spain",139 99,750 ML,0.0,0 Ratings,V 96 RP 95
Site Larner Vineyard Viognier 2018,Viognier,"Ballard Canyon, Santa Barbara, Central Coast, California",44 99,750 ML,0.0,0 Ratings,V 93 JD 91
Leeuwin Estate Prelude Vineyards Cabernet Sauvignon 2017,Cabernet Sauvignon,"Margaret River, Western Australia, Australia",30 99,750 ML,4.0,17 Ratings,JS 92 RP 90
Elsa Bianchi Cabernet Sauvignon 2020,Cabernet Sauvignon,"Mendoza, Argentina",12 99,750 ML,0.0,0 Ratings,JS 89
Gerard Bertrand Naturae Chardonnay 2020,Chardonnay,"Pays d’Oc, South of France, France",19 99,750 ML,0.0,0 Ratings,
Niepoort Tawny Port,Port,Portugal,19,750 ML,4.0,9 Ratings,
Jeriko Estate Upper Russian River Pinot Noir 2018,Pinot Noir,"Mendocino, California",22,750 ML,0.0,0 Ratings,
Bader-Mimeur Bourgogne Rouge Dessous les Mues 2018,Pinot Noir,"Cote de Beaune, Cote d'Or, Burgundy, France",29 99,750 ML,0.0,0 Ratings,
Ca'Nova Colline Novaresi Vespolina 2020,Other Red Wine,"Piedmont, Italy",22 99,750 ML,0.0,0 Ratings,
DAOU Vineyards Paso Robles Chardonnay 2021,Chardonnay,"Paso Robles, Central Coast, California",18 99,750 ML,0.0,0 Ratings,
Schiavenza Barolo Cerretta 2015,Nebbiolo,"Barolo, Piedmont, Italy",57,750 ML,0.0,0 Ratings,WS 93 RP 93 JS 93
Dr. Konstantin Frank Rkatsiteli 2020,Rkatsiteli,"Finger Lakes, New York, Other U.S.",20,750 ML,3.2,8 Ratings,
Mas Champart St. Chinian Clos de la Simonette 2017,Other Red Blends,"Saint-Chinian, Languedoc, South of France, France",44 99,750 ML,0.0,0 Ratings,RP 91
90 Point White Wine Gift Set,,,59 99,750 ML,0.0,0 Ratings,
La Playa Axel Carmenere 2018,Carmenere,"Colchagua Valley, Rapel Valley, Chile",18 99,750 ML,4.0,15 Ratings,WW 89
Terras Gauda Abadia de San Campio Albarino 2020,Albarino,"Rias Baixas, Spain",19 99,750 ML,0.0,0 Ratings,W & S 91 JS 90 WE 90
L'Aventure Estate Cuvee 2019,Other Red Blends,"Willow Creek District, Paso Robles, Central Coast, California",129 99,750 ML,0.0,0 Ratings,JD 100 JS 97 RP 96
Angeline Cabernet Sauvignon 2020,Cabernet Sauvignon,California,15,750 ML,3.4,9 Ratings,JS 91
Kunin Jurassic Park Natural Chenin Blanc 2020,Chenin Blanc,"Los Olivos District, Santa Barbara, Central Coast, California",35 99,750 ML,0.0,0 Ratings,RP 91
Chateau La Freynelle Blanc 2020,Bordeaux White Blends,"Bordeaux, France",19,750 ML,4.2,79 Ratings,WW 89
Peter Mathis Uber Red Blend 2015,Other Red Blends,"Sonoma County, California",35 99,750 ML,0.0,0 Ratings,
Levy & McClellan Proprietary Red 2011,Other Red Blends,"Napa Valley, California",579 97,750 ML,0.0,0 Ratings,
Renato Ratti Marcenasco Barolo 2018,Nebbiolo,"Barolo, Piedmont, Italy",68 99,750 ML,0.0,0 Ratings,JS 92
Haraszthy Family Cellars Bearitage Red Wine 2018,Other Red Blends,"Lodi, California",11 99,750 ML,0.0,0 Ratings,
Viski Belmont Gold Serving Tray,,,69 99,0 ML,0.0,0 Ratings,
Travaglini Coste della Sesia Nebbiolo 2019,Nebbiolo,"Piedmont, Italy",23 99,750 ML,0.0,0 Ratings,
Domaine Dozon Chinon Clos du Saut au Loup 2019,Cabernet Franc,"Chinon, Touraine, Loire, France",24 99,750 ML,0.0,0 Ratings,WE 93
Jax Vineyards Y3 Chardonnay 2020,Chardonnay,"Napa Valley, California",19 99,750 ML,0.0,0 Ratings,WE 92
Domaine Laroche Chablis Les Vaillons Vieilles Vignes Premier Cru 2019,Chardonnay,"Chablis, Burgundy, France",64 99,750 ML,0.0,0 Ratings,WE 94 D 93 W & S 91
Loring Wine Company Aubaine Vineyard Pinot Noir 2016,Pinot Noir,"Central Coast, California",54,750 ML,0.0,0 Ratings,RP 93
Hanna Sauvignon Blanc 2021,Sauvignon Blanc,"Russian River, Sonoma County, California",17 99,750 ML,0.0,0 Ratings,
Adelaida HMR Vineyard Chardonnay 2019,Chardonnay,"Paso Robles, Central Coast, California",43 99,750 ML,0.0,0 Ratings,WE 93 JD 92
Noble Tree Zinfandel 2017,Zinfandel,"Russian River, Sonoma County, California",20 99,750 ML,0.0,0 Ratings,
Taittinger Brut La Francaise,Non-Vintage Sparkling Wine,"Champagne, France",65,750 ML,4.5,345 Ratings,TP 95 JS 92
Trefethen Cabernet Sauvignon (375ML half-bottle) 2019,Cabernet Sauvignon,"Napa Valley, California",37 99,375 ML,0.0,0 Ratings,
Tusk Estates Cabernet Sauvignon 2018,Cabernet Sauvignon,"Napa Valley, California",829 97,750 ML,0.0,0 Ratings,
Chateau Leoville Poyferre (1.5 Liter Futures Pre-Sale) 2020,Bordeaux Red Blends,"St-Julien, Bordeaux, France",219 97,1500 ML,0.0,0 Ratings,WE 98 JS 97 RP 97 JD 97 D 96
Toasted Head Cabernet Sauvignon 2017,Cabernet Sauvignon,California,11 99,750 ML,4.0,10 Ratings,
Prosper Maufoux Hautes Cotes de Nuits Rouge Vigne au Roy 2017,Pinot Noir,"Hautes Cotes de Nuits, Cote de Beaune, Cote d'Or, Burgundy, France",23 99,750 ML,0.0,0 Ratings,
