Name,Varietal,Region,Price,Dosage,Online_Rating,Total_Ratings,sommelier_ratings
Pellet Estate Henry's Reserve 2017,Bordeaux Red Blends,"Napa Valley, California",179 99,750 ML,5.0,15 Ratings,WW 94 V 93 JD 93
Quinta do Vesuvio Vintage Port 2018,Port,"Douro, Portugal",85,750 ML,0.0,0 Ratings,WS 97 JS 96 WE 94 RP 94
Silver Oak Alexander Valley Cabernet Sauvignon (1.5 Liter Magnum) 2017,Cabernet Sauvignon,"Alexander Valley, Sonoma County, California",189 97,1500 ML,0.0,0 Ratings,WW 93
Dolin Rouge Vermouth de Chambery,Vermouth,"South of France, France",17 99,750 ML,0.0,0 Ratings,
Grgich Hills Estate Yountville Old Vine Cabernet Sauvignon 2017,Cabernet Sauvignon,"Yountville, Napa Valley, California",139 99,750 ML,0.0,0 Ratings,
Chateau de la Tour Clos Vougeot Vieilles Vignes Grand Cru 2015,Pinot Noir,"Vougeot, Cote de Nuits, Cote d'Or, Burgundy, France",500,750 ML,0.0,0 Ratings,V 95 BH 95 WS 92
Jacquesson Cuvee 744 Extra Brut,Non-Vintage Sparkling Wine,"Champagne, France",100,750 ML,0.0,0 Ratings,RP 94 JS 92
Girard Cabernet Sauvignon 2018,Cabernet Sauvignon,"Napa Valley, California",29 99,750 ML,4.4,36 Ratings,JS 91
Domaine du Grand Montmirail Gigondas Les Deux Juliettes (375Ml half-bottle) 2019,Rhone Red Blends,"Gigondas, Rhone, France",15 99,375 ML,0.0,0 Ratings,JD 93
Dona Paula 1350 Red Blend 2016,Other Red Blends,"Uco Valley, Mendoza, Argentina",24 99,750 ML,4.1,13 Ratings,JS 92
Penfolds Grange 2014,Syrah/Shiraz,"South Australia, Australia",850,750 ML,4.6,10 Ratings,D 100 RP 98 WS 98 JD 97 WE 97 JS 96 W & S 96
Selbach Oster Zeltinger Himmelreich Riesling Kabinett Halbtrocken 2018,Riesling,"Mosel, Germany",29,750 ML,4.1,15 Ratings,WS 92 W & S 90
Vocal Vineyards Bates Ranch Cabernet Sauvignon 2018,Cabernet Sauvignon,"Santa Cruz Mountains, California",77 99,750 ML,0.0,0 Ratings,
Guy Amiot Bourgogne Blanc 2017,Chardonnay,"Burgundy, France",43 99,750 ML,0.0,0 Ratings,
Bodegas Muga Cava Conde de Haro 2018,Vintage Sparkling Wine,"Rioja, Spain",29 99,750 ML,0.0,0 Ratings,
Mionetto Prosecco Brut (187ML Split),Non-Vintage Sparkling Wine,"Prosecco, Italy",7 99,187 ML,4.2,58 Ratings,
Paitin Barbera d'Alba Serra 2018,Barbera,"Alba, Piedmont, Italy",22 99,750 ML,3.4,5 Ratings,
Antinori Pian delle Vigne Rosso di Montalcino 2019,Sangiovese,"Montalcino, Tuscany, Italy",29 99,750 ML,0.0,0 Ratings,JS 92
Bodegas Vega Sicilia Valbuena 5 2014,Tempranillo,"Ribera del Duero, Spain",215,750 ML,4.6,22 Ratings,RP 96 JS 96 V 96 D 94 WE 94 WS 93
Faiveley Nuits-St-Georges Les Damodes Premier Cru 2018,Pinot Noir,"Nuits-St-Georges, Cote de Nuits, Cote d'Or, Burgundy, France",119 99,750 ML,0.0,0 Ratings,JM 95 RP 92 BH 92
Domaine Tempier La Tourtine Bandol Rouge (1.5 Liter Magnum) 2019,Mourvedre,"Bandol, Provence, South of France, France",199 99,1500 ML,0.0,0 Ratings,
Von Winning Riesling Extra Brut Sekt,Non-Vintage Sparkling Wine,"Pfalz, Germany",27 99,750 ML,4.0,14 Ratings,
Barra of Mendocino Pinot Noir 2019,Pinot Noir,"Mendocino, California",23 99,750 ML,0.0,0 Ratings,WE 92
Lo-Fi Wines Cabernet Franc 2019,Cabernet Franc,"Santa Ynez Valley, Santa Barbara, Central Coast, California",28 99,750 ML,0.0,0 Ratings,
Chateau de Gaudou Tradition 2018,Other Red Blends,"Cahors, Southwest, France",16 99,750 ML,0.0,0 Ratings,
Ruffino Pinot Grigio Lumina 2020,Pinot Gris/Grigio,"Tuscany, Italy",8 99,750 ML,4.1,9 Ratings,
Casa Rossa Rosso,Other Red Wine,"Tuscany, Italy",13 99,750 ML,4.3,56 Ratings,
A.R. Lenoble Grand Cru Blanc de Blancs 2012,Vintage Sparkling Wine,"Champagne, France",99 99,750 ML,0.0,0 Ratings,WE 92 WS 92 D 91
Guido Porro Vigna l'Pari Dolcetto d'Alba 2017,Dolcetto,"Alba, Piedmont, Italy",21 99,750 ML,0.0,0 Ratings,
Louis Jadot Bourgogne Pinot Noir 2019,Pinot Noir,"Burgundy, France",21 99,750 ML,3.8,5 Ratings,
Dei Rosso di Montepulciano 2020,Sangiovese,"Montepulciano, Tuscany, Italy",17 99,750 ML,0.0,0 Ratings,
Henri Bourgeois Sancerre La Cote des Monts Damnes 2020,Sauvignon Blanc,"Sancerre, Loire, France",39 99,750 ML,4.9,11 Ratings,JS 92
Tornatore Pietrarizzo Etna Rosso 2016,Nerello Mascalese,"Sicily, Italy",47 99,750 ML,3.9,129 Ratings,JS 93 WE 93
"Folk Tree ""Village Series"" Chardonnay 2018",Chardonnay,California,20 99,750 ML,0.0,0 Ratings,
Sinor-LaVallee White Label Syrah 2013,Syrah/Shiraz,"Central Coast, California",44 99,750 ML,0.0,0 Ratings,
Benovia Tilton Hill Pinot Noir 2017,Pinot Noir,"Sonoma Coast, Sonoma County, California",60 98,750 ML,0.0,0 Ratings,CG 92
Red Rock Malbec 2019,Malbec,"Mendoza, Argentina",9 99,750 ML,0.0,0 Ratings,
Davey & Browne Vortex 2017,Cabernet Sauvignon,"McLaren Vale, South Australia, Australia",21 99,750 ML,3.6,7 Ratings,WW 91 JS 90
Carol Shelton Wild Thing Rendezvous Rose 2021,Rosé,"Mendocino, California",18 99,750 ML,0.0,0 Ratings,
Realm Cellars Beckstoffer To Kalon Cabernet Sauvignon 2012,Cabernet Sauvignon,"Oakville, Napa Valley, California",349 97,750 ML,0.0,0 Ratings,RP 97 WS 93
Weingut Willi Schaefer Graacher Himmelreich Riesling Kabinett 2020,Riesling,"Mosel, Germany",44 99,750 ML,0.0,0 Ratings,JS 94 RP 93
Chateau Hyot 2016,Bordeaux Red Blends,"Cotes de Castillon, Bordeaux, France",14 99,750 ML,3.7,23 Ratings,JS 90
L’Atelier Classic Wing Corkscrew,,,39 99,0 ML,0.0,0 Ratings,
L'Ecole 41 Columbia Valley Merlot 2018,Merlot,"Columbia Valley, Washington",24 99,750 ML,3.9,24 Ratings,
Domaine De La Verde Vacqueyras Prelude 2018,Rhone Red Blends,"Vacqueyras, Rhone, France",25,750 ML,0.0,0 Ratings,JD 89
Rocca di Frassinello Maremma Ornello 2016,Tuscan Blends,"Tuscany, Italy",27 99,750 ML,0.0,0 Ratings,WS 92
Domaine Meo-Camuzet Clos de Vougeot Grand Cru Pres le Cellier 2017,Pinot Noir,"Vougeot, Cote de Nuits, Cote d'Or, Burgundy, France",450,750 ML,0.0,0 Ratings,WS 96 D 94 BH 93
Bruno Giacosa Barbaresco Rabaja 1996,Nebbiolo,"Barbaresco, Piedmont, Italy",559 97,750 ML,0.0,0 Ratings,
Bodegas Altanza Lealtanza Reserva 2014,Tempranillo,"Rioja, Spain",28 99,750 ML,0.0,0 Ratings,JS 90
Matanzas Creek Sonoma County Sauvignon Blanc 2020,Sauvignon Blanc,"Sonoma County, California",22,750 ML,0.0,0 Ratings,
Boizel Brut Reserve,Non-Vintage Sparkling Wine,"Champagne, France",49 99,750 ML,4.0,7 Ratings,D 97 WE 90 WS 90
Sextant Central Coast Chardonnay 2018,Chardonnay,"Central Coast, California",17 99,750 ML,0.0,0 Ratings,
Rhys Vineyards Alpine Vineyard Pinot Noir 2009,Pinot Noir,"Santa Cruz Mountains, California",149 97,750 ML,0.0,0 Ratings,BH 93
90 Point Red & White Schug Winery Gift Set,,,66,0 ML,0.0,0 Ratings,
Abacela Fiesta Tempranillo 2018,Tempranillo,"Umpqua Valley, Oregon",34 99,750 ML,3.9,5 Ratings,JS 90 WE 90
Laffourcade Savennieres 2018,Chenin Blanc,"Anjou, Loire, France",34 99,750 ML,4.3,5 Ratings,
Dugat-Py Gevrey-Chambertin Champeaux Vieilles Vignes Premier Cru 2019,Pinot Noir,"Gevrey-Chambertin, Cote de Nuits, Cote d'Or, Burgundy, France",399 99,750 ML,0.0,0 Ratings,V 95 BH 94 RP 94
Luca Old Vine Malbec 2018,Malbec,"Uco Valley, Mendoza, Argentina",30 99,750 ML,4.2,125 Ratings,JS 94 WE 93 RP 92
Paul Pernot Puligny-Montrachet Folatieres Premer Cru 2020,Chardonnay,"Puligny-Montrachet, Cote de Beaune, Cote d'Or, Burgundy, France",129 99,750 ML,0.0,0 Ratings,JM 93
Tenuta di Ghizzano Nambrot 2017,Bordeaux Red Blends,"Tuscany, Italy",46 99,750 ML,0.0,0 Ratings,JS 92
Sine Qua Non Omega Pinot Noir 2003,Pinot Noir,California,609 97,750 ML,0.0,0 Ratings,RP 93
Bodega Pablo Fallabrino Barbera 2019,Barbera,Uruguay,19 99,750 ML,0.0,0 Ratings,
Domaine de Montille Clos Vougeot Grand Cru 2018,Pinot Noir,"Vougeot, Cote de Nuits, Cote d'Or, Burgundy, France",264 99,750 ML,0.0,0 Ratings,BH 94 RP 94
Chateau Coupe Roses Granaxa 2015,Grenache,"Minervois, Languedoc, South of France, France",30 99,750 ML,2.9,9 Ratings,
Hewitson Miss Harry Chardonnay 2016,Chardonnay,"Barossa, South Australia, Australia",19 98,750 ML,2.9,5 Ratings,
Berlucchi '61 Brut Rose,Sparkling Rosé,"Lombardy, Italy",35 99,750 ML,0.0,0 Ratings,WE 92 WS 91 TP 90 JS 90 RP 90
Domaine Bruno Clavelier Nuits-St-Georges Aux Cras Vieilles Vignes Premier Cru 2017,Pinot Noir,"Nuits-St-Georges, Cote de Nuits, Cote d'Or, Burgundy, France",189 97,750 ML,0.0,0 Ratings,BH 93
Quinta do Vesuvio Douro Red 2015,Other Red Blends,"Douro, Portugal",81 99,750 ML,0.0,0 Ratings,WE 95
Kangarilla Road Chardonnay 2019,Chardonnay,"Adelaide Hills, South Australia, Australia",23 99,750 ML,4.6,5 Ratings,
Sarah's Vineyard Madonne GSM 2017,Rhone Red Blends,"Santa Clara Valley, San Francisco Bay, Central Coast, California",23 99,750 ML,0.0,0 Ratings,
Pali Wine Co Fiddlestix Pinot Noir 2017,Pinot Noir,"Sta. Rita Hills, Santa Barbara, Central Coast, California",68 99,750 ML,0.0,0 Ratings,WE 92 JD 90
Vincent Girardin Corton-Charlemagne Grand Cru 2001,Chardonnay,"Burgundy, France",155 97,750 ML,0.0,0 Ratings,RP 90
Valley of the Moon Pinot Gris-Viognier 2021,Other White Blends,"Sonoma County, California",15 99,750 ML,0.0,0 Ratings,
Clos Du Val Napa Valley Chardonnay 2019,Chardonnay,"Napa Valley, California",32,750 ML,0.0,0 Ratings,WE 92
Le Corti Don Tommaso Chianti Classico Gran Selezione 2016,Sangiovese,"Chianti Classico, Chianti, Tuscany, Italy",49 99,750 ML,0.0,0 Ratings,JS 96 RP 93 WE 90
Anthem Mt. Veeder Estate Cabernet Sauvignon 2015,Cabernet Sauvignon,"Mt. Veeder, Napa Valley, California",99 97,750 ML,0.0,0 Ratings,
Billecart Salmon Brut Reserve & Gold Gift Box,,,64 99,750 ML,0.0,0 Ratings,
Anarchist Wine Co. Anarchist White Blend 2019,Other White Blends,"Clarksburg, Yolo County, California",23 99,750 ML,0.0,0 Ratings,
Chateau Loudenne Blanc 2016,Other White Blends,"Bordeaux, France",29 99,750 ML,0.0,0 Ratings,
Chateau Cos d'Estournel Goulee 2016,Bordeaux Red Blends,"Medoc, Bordeaux, France",36 99,750 ML,3.5,5 Ratings,JS 93
Dark Horse Sauvignon Blanc 2020,Sauvignon Blanc,California,7 99,750 ML,3.6,56 Ratings,
Rhys Vineyards Skyline Vineyard Syrah 2008,Syrah/Shiraz,"Santa Cruz Mountains, California",89 97,750 ML,0.0,0 Ratings,RP 90
Terres Blondes Sauvignon Blanc 2018,Sauvignon Blanc,"Touraine, Loire, France",13 99,750 ML,0.0,0 Ratings,
Outpost True Vineyard Cabernet Sauvignon 2016,Cabernet Sauvignon,"Howell Mountain, Napa Valley, California",399 97,750 ML,0.0,0 Ratings,RP 100 JD 99 JS 95
Lava Cap Reserve Chardonnay 2019,Chardonnay,"El Dorado, Sierra Foothills, California",23 99,750 ML,3.9,12 Ratings,WE 90
Chateau Pavie (1.5 Liter Magnum) 2018,Bordeaux Red Blends,"St. Emilion, Bordeaux, France",879 99,1500 ML,0.0,0 Ratings,JD 100 JS 99 RP 99 WS 98 D 96
Selbach Mosel Riesling Kabinett (Fish Label) 2018,Riesling,"Mosel, Germany",18 99,750 ML,0.0,0 Ratings,
Dominus Estate 2002,Bordeaux Red Blends,"Napa Valley, California",429 97,750 ML,0.0,0 Ratings,RP 99 W & S 94
Canvasback Red Mountain Cabernet Sauvignon (1.5 Liter Magnum) 2017,Cabernet Sauvignon,"Red Mountain, Yakima Valley, Columbia Valley, Washington",79 99,1500 ML,0.0,0 Ratings,W & S 93 WE 91 JD 91 RP 90
Arrowood Reserve Speciale Cabernet Sauvignon 2014,Cabernet Sauvignon,"Sonoma Valley, Sonoma County, California",100,750 ML,4.8,5 Ratings,RP 95
Ledge MCA Cuvee 2018,Other Red Blends,"Paso Robles, Central Coast, California",39 99,750 ML,0.0,0 Ratings,JD 94
Chateau Cheval Blanc (Futures Pre-Sale) 2020,Bordeaux Red Blends,"St. Emilion, Bordeaux, France",569 97,750 ML,0.0,0 Ratings,D 99
Maso Canali Pinot Grigio 2020,Pinot Gris/Grigio,"Trentino-Alto Adige, Italy",17 99,750 ML,0.0,0 Ratings,
Chateau Cheval Blanc (bin soiled labels) 1995,Bordeaux Red Blends,"St. Emilion, Bordeaux, France",549 97,750 ML,0.0,0 Ratings,
Patz & Hall Zio Tony Ranch Chardonnay 2018,Chardonnay,"Russian River, Sonoma County, California",69 99,750 ML,0.0,0 Ratings,
Passionate Wines Via Revolucionaria Bonarda Pura 2020,Bonarda,"Mendoza, Argentina",14 99,750 ML,4.0,5 Ratings,
St. Innocent Freedom Hill Pinot Blanc 2019,Pinot Blanc,"Eola-Amity Hills, Willamette Valley, Oregon",21 99,750 ML,0.0,0 Ratings,
Hudelot-Noellat Chambolle Musigny 2012,Pinot Noir,"Chambolle-Musigny, Cote de Nuits, Cote d'Or, Burgundy, France",139 97,750 ML,0.0,0 Ratings,
Kracher Trocken Pinot Gris 2019,Pinot Gris/Grigio,"Burgenland, Austria",22 99,750 ML,0.0,0 Ratings,
Il Borro Lamelle Chardonnay 2020,Chardonnay,"Tuscany, Italy",22 99,750 ML,0.0,0 Ratings,TP 92
Revana Terroir Series Napa Valley Cabernet Sauvignon 2017,Cabernet Sauvignon,"St. Helena, Napa Valley, California",105,750 ML,0.0,0 Ratings,
Chateau Pontet-Canet (1.5 Liter Futures Pre-Sale) 2020,Bordeaux Red Blends,"Pauillac, Bordeaux, France",224 97,1500 ML,0.0,0 Ratings,JS 99 RP 98 WE 98 D 97
Domaine Drouhin Oregon Pinot Noir 2019,Pinot Noir,"Dundee Hills, Willamette Valley, Oregon",44 99,750 ML,4.6,9 Ratings,RP 96 JS 94 WS 93 WE 92
Reserve de Bonpas Chateauneuf-du-Pape 2017,Rhone Red Blends,"Chateauneuf-du-Pape, Rhone, France",59 99,750 ML,0.0,0 Ratings,
Halter Ranch Vineyard Cotes de Paso 2019,Rhone Red Blends,"Adelaida District, Paso Robles, Central Coast, California",46,750 ML,0.0,0 Ratings,
Silver Ridge Cabernet Sauvignon 2017,Cabernet Sauvignon,California,10 99,750 ML,0.0,0 Ratings,
Sarah's Vineyard Santa Cruz Mountains Pinot Noir 2017,Pinot Noir,"Central Coast, California",45,750 ML,0.0,0 Ratings,RP 92 WW 92
Casa Ferreirinha Quinta da Leda 2018,Other Red Blends,"Douro, Portugal",76 99,750 ML,0.0,0 Ratings,
Rhys Vineyards Horseshoe Vineyard Pinot Noir 2009,Pinot Noir,"Santa Cruz Mountains, California",109 97,750 ML,0.0,0 Ratings,RP 94 WS 92
Bodega Lanzaga Lanzaga 2017,Tempranillo,"Rioja, Spain",39 99,750 ML,0.0,0 Ratings,RP 94
Laurel Glen Sonoma Mountain Estate Cabernet Sauvignon 2016,Cabernet Sauvignon,"Sonoma Mountain, Sonoma Valley, Sonoma County, California",99 99,750 ML,0.0,0 Ratings,WE 94 W & S 92
Bodegas Mas Alta Romani La Basseta 2017,Grenache,"Priorat, Spain",79 99,750 ML,0.0,0 Ratings,RP 94
Massolino Barbera d'Alba 2020,Barbera,"Alba, Piedmont, Italy",27 99,750 ML,0.0,0 Ratings,
Clos des Fous PMG Pinot Noir 2019,Pinot Noir,Chile,17 99,750 ML,0.0,0 Ratings,
Yealands Estate Single Vineyard Pinot Noir 2019,Pinot Noir,"Marlborough, New Zealand",34 99,750 ML,3.6,9 Ratings,WW 92 JS 90 RP 90
Matanzas Creek Alexander Valley Merlot 2018,Merlot,"Alexander Valley, Sonoma County, California",40,750 ML,0.0,0 Ratings,
Marchesi di Gresy Barbaresco Martinenga (375ML half-bottle) 2017,Nebbiolo,"Barbaresco, Piedmont, Italy",38 99,375 ML,0.0,0 Ratings,RP 94 WS 93 WE 93
Kim Crawford Pinot Noir 2019,Pinot Noir,New Zealand,17 99,750 ML,4.4,6 Ratings,
William Knuttel Bill’s Hidden Track Pinot Noir 2018,Pinot Noir,"Sonoma Coast, Sonoma County, California",22,750 ML,0.0,0 Ratings,
Parador Reserva Red 2012,Other Red Blends,"Napa Valley, California",69 99,750 ML,0.0,0 Ratings,WW 92
Sine Qua Non This Is Not An Exit Grenache (Esto No Es una Salida) 2009,Grenache,California,599 97,750 ML,0.0,0 Ratings,RP 96 WS 93
Nicole Lamarche Vosne-Romanee Les Malconsorts Premier Cru 2018,Pinot Noir,"Vosne-Romanee, Cote de Nuits, Cote d'Or, Burgundy, France",339 99,750 ML,0.0,0 Ratings,V 94
Cantine Maschio Sparkling Rose,Sparkling Rosé,"Veneto, Italy",12 99,750 ML,0.0,0 Ratings,
Frank Family Vineyards Chardonnay 2020,Chardonnay,"Carneros, California",36 99,750 ML,4.4,5 Ratings,V 92
Ramos Pinto 10 Year Tawny Ervamoira,Port,Portugal,41 99,750 ML,4.2,40 Ratings,WS 92 W & S 92 D 92 RP 91 WE 90 WW 90
Flowers Sonoma Coast Chardonnay & Godiva White Chocolate Gift Box,,,84 99,0 ML,0.0,0 Ratings,
Guerrieri Rizzardi Pojega Ripasso della Valpolicella 2015,Other Red Blends,"Valpolicella, Veneto, Italy",23 99,750 ML,0.0,0 Ratings,
Domaine Raoul Gautherin & Fils Chablis Vieilles Vignes 2018,Chardonnay,"Chablis, Burgundy, France",40 99,750 ML,0.0,0 Ratings,
Azelia Barolo Bricco Fiasco (stained labels) 1996,Nebbiolo,"Barolo, Piedmont, Italy",129 97,750 ML,0.0,0 Ratings,RP 93 WS 91
Louis Metaireau Muscadet Black Label Sur Lie 2020,Melon de Bourgogne,"Pays Nantais, Loire, France",21 99,750 ML,0.0,0 Ratings,
Bodega Pablo Fallabrino Tannat Normale 2018,Tannat,Uruguay,41 99,750 ML,3.9,6 Ratings,
Zuccardi Finca Piedra Infinita Supercal 2017,Malbec,"Uco Valley, Mendoza, Argentina",249 99,750 ML,0.0,0 Ratings,RP 97 JS 97
Pomona Chianti Classico Riserva 2017,Sangiovese,"Chianti Classico, Chianti, Tuscany, Italy",32 99,750 ML,0.0,0 Ratings,
No Girls La Paciencia Vineyard Grenache 2014,Grenache,"Walla Walla Valley, Columbia Valley, Washington",134 97,750 ML,0.0,0 Ratings,WS 94 JS 93
Domaine de la Solitude Cotes Du Rhone Red 2020,Rhone Red Blends,"Cotes du Rhone, Rhone, France",15 99,750 ML,0.0,0 Ratings,JS 92
Quinta de la Rosa Vintage Port 2016,Port,"Douro, Portugal",90,750 ML,0.0,0 Ratings,WE 95 RP 93 WS 92
Giuseppe Cortese Langhe Nebbiolo 2018,Nebbiolo,"Piedmont, Italy",29 99,750 ML,3.9,21 Ratings,JS 91 WS 90
Diwald Grossriedenthaler Loss Zweigelt 2019,Zweigelt,Austria,21 99,750 ML,0.0,0 Ratings,
Domaine de la Fruitiere Chardonnay 2020,Chardonnay,"Loire, France",17 99,750 ML,0.0,0 Ratings,
Giant Steps Yarra Valley Chardonnay 2021,Chardonnay,"Yarra Valley, Victoria, Australia",34 99,750 ML,0.0,0 Ratings,JH 95
Sine Qua Non Trouver l'Arene Syrah (1.5 Liter Magnum) 2015,Syrah/Shiraz,California,"1,199 97",1500 ML,0.0,0 Ratings,
Rutherford Ranch Cabernet Sauvignon 2018,Cabernet Sauvignon,"Napa Valley, California",34,750 ML,4.0,98 Ratings,WS 91
Banfi Chianti Classico 2019,Sangiovese,"Chianti Classico, Chianti, Tuscany, Italy",15 99,750 ML,3.7,27 Ratings,WS 91
Fairsing Vineyard Sullivan Pinot Noir 2016,Pinot Noir,"Yamhill-Carlton District, Willamette Valley, Oregon",62,750 ML,0.0,0 Ratings,WS 92 RP 90
Quinta do Vesuvio Vintage Port Capela 2017,Port,Portugal,179 99,750 ML,0.0,0 Ratings,JS 99 WS 97 D 97 WE 95 W & S 93
Chateau Clos St. Martin (Futures Pre-Sale) 2020,Bordeaux Red Blends,"St. Emilion, Bordeaux, France",109 97,750 ML,0.0,0 Ratings,D 94 RP 92
Dominio del Aguila Picaro Clarete 2018,Rosé,"Ribera del Duero, Spain",34 99,750 ML,0.0,0 Ratings,
Terlan Pinot Bianco 2020,Pinot Blanc,"Trentino-Alto Adige, Italy",22 99,750 ML,3.8,36 Ratings,JS 92
The Terraces Rutherford Cabernet Sauvignon 2017,Cabernet Sauvignon,"Rutherford, Napa Valley, California",69 99,750 ML,0.0,0 Ratings,
Cobb Wines Doc's Ranch JoAnn's Block Chardonnay 2018,Chardonnay,"Sonoma Coast, Sonoma County, California",69 99,750 ML,0.0,0 Ratings,D 94 V 93
Arzuaga Reserva 2016,Tempranillo,"Ribera del Duero, Spain",63 99,750 ML,0.0,0 Ratings,JS 92 D 90
Champagne Legras & Haas Intuition Brut,Non-Vintage Sparkling Wine,"Champagne, France",63 99,750 ML,0.0,0 Ratings,
Lavinea Elton Pinot Noir 2017,Pinot Noir,"Eola-Amity Hills, Willamette Valley, Oregon",75 99,750 ML,0.0,0 Ratings,WS 93 WE 91 JS 91
Melanie Pfister Cuvee 8 2016,Other White Blends,"Alsace, France",35,750 ML,0.0,0 Ratings,JS 93
Xavier Monnot Meursault Le Limozin 2019,Chardonnay,"Meursault, Cote de Beaune, Cote d'Or, Burgundy, France",84 99,750 ML,0.0,0 Ratings,
Vera Wang Party Prosecco,Non-Vintage Sparkling Wine,"Veneto, Italy",26 99,750 ML,4.7,5 Ratings,SJ 90
Numanthia Toro 2016,Tempranillo,"Toro, Spain",55 99,750 ML,0.0,0 Ratings,JS 95 WS 93
Nautilus Sauvignon Blanc 2020,Sauvignon Blanc,"Marlborough, New Zealand",20,750 ML,4.0,140 Ratings,JS 92 WS 92 D 90 RP 90
Dalamara Paliokalias 2017,Other Red Wine,"Naoussa, Greece",44 99,750 ML,3.2,6 Ratings,
Paul Lato Matinee Grenache 2016,Grenache,"Santa Barbara, Central Coast, California",49 99,750 ML,0.0,0 Ratings,
Matane Primitivo Puglia 2020,Primitivo,Italy,13 99,750 ML,0.0,0 Ratings,
Nicolas Reau Anjou Ange Rouge 2020,Cabernet Franc,"Anjou, Loire, France",19 99,750 ML,3.7,7 Ratings,
Philipponnat Clos des Goisses 2009,Vintage Sparkling Wine,"Champagne, France",321,750 ML,0.0,0 Ratings,RP 96 JS 94 WS 94 D 93
Doniene Gorrondona Txakolina 2020,Other White Blends,"Txakolina, Spain",21 99,750 ML,0.0,0 Ratings,
Ao Yun Shangri-La 2014,Bordeaux Red Blends,China,299 99,750 ML,4.9,6 Ratings,JS 94 WE 93 RP 91
Kanonkop Kadette Cape Blend 2019,Other Red Blends,"Stellenbosch, South Africa",16 99,750 ML,3.5,32 Ratings,JS 92
Sattler St. Laurent 2019,St. Laurent,"Burgenland, Austria",22 99,750 ML,3.2,8 Ratings,
Roberto Henriquez Molino del Ciego 2019,Semillon,"Bio Bio Valley, Chile",30,750 ML,3.7,12 Ratings,
Tyler Winery Bien Nacido W Block Chardonnay 2018,Chardonnay,"Santa Maria Valley, Central Coast, California",59 99,750 ML,0.0,0 Ratings,V 92
Schmitges Mosel vom Berg Riesling Qba 2015,Riesling,"Mosel, Germany",19 99,750 ML,0.0,0 Ratings,
Domaine de la Pousse d'Or Chambolle-Musigny Les Groseilles Premier Cru 2018,Pinot Noir,"Chambolle-Musigny, Cote de Nuits, Cote d'Or, Burgundy, France",139 99,750 ML,0.0,0 Ratings,BH 92
Rhys Vineyards Rhys Swan Terrace Pinot Noir 2008,Pinot Noir,"Santa Cruz Mountains, California",139 97,750 ML,0.0,0 Ratings,BH 94
Vanderpump Red Sangria,Fruit Wine,California,13 99,750 ML,3.5,56 Ratings,
Chateau Pape Clement Blanc 2017,Bordeaux White Blends,"Pessac-Leognan, Bordeaux, France",159 99,750 ML,0.0,0 Ratings,JD 97 JS 96 WS 95 D 94 RP 94 WE 91
Chateau Calon-Segur 2003,Bordeaux Red Blends,"St. Estephe, Bordeaux, France",165 97,750 ML,0.0,0 Ratings,WS 95 RP 94 WE 94 JS 94
Cantine Maschio Prosecco Brut,Non-Vintage Sparkling Wine,"Prosecco, Italy",18,750 ML,3.8,289 Ratings,W & S 91
Koyle Gran Reserva Carmenere 2019,Carmenere,"Colchagua Valley, Rapel Valley, Chile",14 99,750 ML,3.7,11 Ratings,RP 91 JS 91
Domaine Marc Roy Gevrey-Chambertin Vieilles Vignes 2014,Pinot Noir,"Gevrey-Chambertin, Cote de Nuits, Cote d'Or, Burgundy, France",119 97,750 ML,0.0,0 Ratings,D 93
Frescobaldi Tenuta Perano Chianti Classico 2017,Sangiovese,"Chianti Classico, Chianti, Tuscany, Italy",24 99,750 ML,3.4,19 Ratings,JS 93 RP 92 WE 90
Gerard Bertrand Code Rouge Blanc de Blanc,Non-Vintage Sparkling Wine,"Cremant de Limoux, Limoux, Languedoc, South of France, France",24 99,750 ML,4.3,22 Ratings,W & S 90
Domaine le Clos des Lumieres Cotes du Rhone Villages Zero Sulfites 2019,Rhone Red Blends,"Cotes du Rhone Villages, Rhone, France",20 99,750 ML,0.0,0 Ratings,
Monte Rio Petite Sirah 2020,Petite Sirah,"Lodi, California",25 99,750 ML,0.0,0 Ratings,
Kosta Browne Gap's Crown Vineyard Pinot Noir (1.5 Liter Magnum) 2019,Pinot Noir,"Petaluma Gap, Sonoma Coast, Sonoma County, California",399 97,1500 ML,0.0,0 Ratings,
Mahi Pinot Noir 2018,Pinot Noir,"Marlborough, New Zealand",26 99,750 ML,3.3,6 Ratings,JS 92
Chateau Thivin Brouilly Reverdon 2020,Gamay,"Beaujolais, Burgundy, France",28 99,750 ML,3.2,5 Ratings,JS 92 RP 91
Domaine Romy Bourgogne Pinot Noir 2015,Pinot Noir,"Burgundy, France",21 99,750 ML,3.2,6 Ratings,
Continuum (1.5 Liter Magnum) 2017,Bordeaux Red Blends,"Napa Valley, California",549 99,1500 ML,0.0,0 Ratings,JS 98 RP 97
Honoro Vera Red Blend 2020,Rhone Red Blends,"Jumilla, Spain",9 99,750 ML,0.0,0 Ratings,
MacMurray Ranch Russian River Pinot Noir 2019,Pinot Noir,"Russian River, Sonoma County, California",25 99,750 ML,4.1,9 Ratings,
J. Christopher Willamette Valley Sauvignon Blanc 2018,Sauvignon Blanc,"Willamette Valley, Oregon",24 99,750 ML,3.9,13 Ratings,WE 90 WS 90 JS 90
Maison Leroy Bourgogne Blanc 2017,Chardonnay,"Burgundy, France",179 99,750 ML,0.0,0 Ratings,
Torbreck The Steading Blanc 2020,Rhone White Blends,"Barossa Valley, Barossa, South Australia, Australia",32 99,750 ML,0.0,0 Ratings,JS 91
Patrice Rion Nuits-Saint-Georges Vieilles Vignes 2016,Pinot Noir,"Nuits-St-Georges, Cote de Nuits, Cote d'Or, Burgundy, France",72 99,750 ML,0.0,0 Ratings,RP 92 BH 91
Chateau Pavie (1.5 Liter Magnum) 2017,Bordeaux Red Blends,"St. Emilion, Bordeaux, France",799 97,1500 ML,0.0,0 Ratings,JD 99 RP 99 JS 97 WS 97 D 96 WE 95
Robert Weil Kiedrich Grafenberg Riesling Auslese (375ML half-bottle) 2020,Riesling,"Rheingau, Germany",79 99,375 ML,0.0,0 Ratings,RP 97 JS 97
Kosta Browne Keefer Ranch Vineyard Pinot Noir (1.5 Liter Magnum) 2019,Pinot Noir,"Russian River, Sonoma County, California",399 97,1500 ML,0.0,0 Ratings,
The Hilt Estate Chardonnay 2018,Chardonnay,"Sta. Rita Hills, Santa Barbara, Central Coast, California",44 99,750 ML,0.0,0 Ratings,JD 94 W & S 93
Cavit Pinot Noir 2020,Pinot Noir,"Veneto, Italy",8 99,750 ML,2.7,5 Ratings,
Vina Robles Viognier 2021,Viognier,"Paso Robles, Central Coast, California",15 99,750 ML,0.0,0 Ratings,
Sanford Sta. Rita Hills Chardonnay 2017,Chardonnay,"Sta. Rita Hills, Santa Barbara, Central Coast, California",40,750 ML,3.9,18 Ratings,WE 92 RP 90 JD 90 JS 90
Chateau de Vaudieu Chateauneuf-du-Pape Vieille Vignes Blanc 2018,Rhone White Blends,"Chateauneuf-du-Pape, Rhone, France",71 99,750 ML,0.0,0 Ratings,
Lucienne Doctor's Vineyard Pinot Noir 2019,Pinot Noir,"Santa Lucia Highlands, Monterey, Central Coast, California",54 99,750 ML,0.0,0 Ratings,
Alto Moncayo Aquilon 2016,Grenache,"Campo de Borja, Spain",200,750 ML,4.2,9 Ratings,V 95 RP 93
Bread & Butter California Chardonnay 2020,Chardonnay,California,16,750 ML,4.0,25 Ratings,
Markus Molitor Wehlener Klosterberg Riesling Spatlese 2018,Riesling,"Mosel, Germany",41 99,750 ML,0.0,0 Ratings,
Gruet Blanc de Noirs (375ML half-bottle),Non-Vintage Sparkling Wine,"New Mexico, Other U.S.",13 99,375 ML,3.9,25 Ratings,WW 90 TP 90 WS 90
Colpetrone Sagrantino di Montefalco 2012,Sagrantino,"Umbria, Italy",29,750 ML,3.9,50 Ratings,V 91 JS 90
Clos des Fous Pucalan Pinot Noir 2017,Pinot Noir,"Aconcagua Valley, Chile",56 99,750 ML,0.0,0 Ratings,RP 93 JS 93
Domaine Jean-Claude Marsanne Ardeche Syrah Mauve 2019,Syrah/Shiraz,"Rhone, France",35,750 ML,0.0,0 Ratings,
Long Meadow Ranch Farmstead Pinot Noir 2017,Pinot Noir,"Sonoma Coast, Sonoma County, California",34 99,750 ML,0.0,0 Ratings,
Reserve de Bonpas Cotes du Rhone 2020,Rhone Red Blends,"Cotes du Rhone, Rhone, France",12 99,750 ML,0.0,0 Ratings,
Familia Traversa Cabernet Sauvignon 2018,Cabernet Sauvignon,Uruguay,10 99,750 ML,0.0,0 Ratings,
Talmard Macon Chardonnay 2020,Chardonnay,"Maconnais, Burgundy, France",17 99,750 ML,0.0,0 Ratings,
Mas Martinet Clos Martinet Priorat 2017,Rhone Red Blends,"Priorat, Spain",100,750 ML,4.5,5 Ratings,RP 95 JD 94
