Name,Varietal,Region,Price,Dosage,Online_Rating,Total_Ratings,sommelier_ratings
Lucien Le Moine Chambolle-Musigny Les Charmes Premier Cru 2017,Pinot Noir,"Chambolle-Musigny, Cote de Nuits, Cote d'Or, Burgundy, France",199 99,750 ML,0.0,0 Ratings,BH 93
WillaKenzie Estate Chardonnay 2018,Chardonnay,"Willamette Valley, Oregon",35 99,750 ML,4.2,6 Ratings,WW 91 RP 90
Sebastien Blachon Saint-Joseph Premiere 2016,Syrah/Shiraz,"Saint-Joseph, Rhone, France",41 99,750 ML,0.0,0 Ratings,
Carlos Serres Gran Reserva 2012,Tempranillo,"Rioja, Spain",25 99,750 ML,3.8,15 Ratings,TP 93 WE 90
La Serena Brunello di Montalcino 2016,Sangiovese,"Montalcino, Tuscany, Italy",55 99,750 ML,0.0,0 Ratings,JS 94
Averaen Eola Springs Vineyard Pinot Noir 2017,Pinot Noir,"Eola-Amity Hills, Willamette Valley, Oregon",44 99,750 ML,0.0,0 Ratings,V 93
Les Garrigues Cotes du Rhone 2019,Rhone Red Blends,"Cotes du Rhone, Rhone, France",14 99,750 ML,3.6,24 Ratings,
Chapter 24 The Fire Pinot Noir 2015,Pinot Noir,"Willamette Valley, Oregon",56 99,750 ML,4.2,6 Ratings,RP 92 WS 90
Voliero Rosso di Montalcino 2019,Sangiovese,"Montalcino, Tuscany, Italy",26,750 ML,0.0,0 Ratings,JD 91 JS 91
Pewsey Vale Eden Valley Dry Riesling 2019,Riesling,"Eden Valley, Barossa, South Australia, Australia",16 99,750 ML,3.8,102 Ratings,
JM Fonseca Twin Vines Vinho Verde 2020,Other White Blends,"Vinho Verde, Portugal",10 99,750 ML,0.0,0 Ratings,TP 89
Neyers 304 Sonoma Chardonnay 2020,Chardonnay,"Sonoma County, California",25 99,750 ML,0.0,0 Ratings,
Domaine Ponsot Clos de Vougeot Vieilles Vignes 2018,Pinot Noir,"Vougeot, Cote de Nuits, Cote d'Or, Burgundy, France",499 99,750 ML,0.0,0 Ratings,D 95 RP 94 BH 93
Dry Creek Vineyard Cabernet Sauvignon (375ML half-bottle) 2018,Cabernet Sauvignon,"Sonoma County, California",15 99,375 ML,0.0,0 Ratings,
Brand Proprietary Red 2016,Bordeaux Red Blends,"Napa Valley, California",324 99,750 ML,0.0,0 Ratings,RP 96 V 94
Adelina Wines Watervale Riesling 2021,Riesling,"Clare Valley, South Australia, Australia",28,750 ML,0.0,0 Ratings,
Anne Pichon Sauvage Syrah Grenache 2019,Rhone Red Blends,"Cotes du Ventoux, Rhone, France",17 99,750 ML,4.6,10 Ratings,
Remelluri Rioja Reserva 2006,Tempranillo,"Rioja, Spain",76 99,750 ML,0.0,0 Ratings,
Opaque Zinfandel 2017,Zinfandel,"Paso Robles, Central Coast, California",23 99,750 ML,4.0,39 Ratings,WE 91
Domaine la Florane Cotes du Rhone Villages Fleur de Pampre Rouge 2019,Rhone Red Blends,"Cotes du Rhone Villages, Rhone, France",16 99,750 ML,0.0,0 Ratings,
Stringtown Pinot Noir 2019,Pinot Noir,Oregon,18 99,750 ML,3.3,5 Ratings,
Bouchard Pere & Fils Gevrey-Chambertin Les Cazetiers Premier Cru 2019,Pinot Noir,"Gevrey-Chambertin, Cote de Nuits, Cote d'Or, Burgundy, France",239 99,750 ML,0.0,0 Ratings,JM 94 RP 93 BH 93
Chereau Carre l'Oiseliniere Muscadet Sevre et Maine 2019,Melon de Bourgogne,"Pays Nantais, Loire, France",21 99,750 ML,0.0,0 Ratings,
Chateau Cheval Blanc (1.5 Liter Futures Pre-Sale) 2020,Bordeaux Red Blends,"St. Emilion, Bordeaux, France","1,139 97",1500 ML,0.0,0 Ratings,D 99
Terrazas de los Andes Altos del Plata Cabernet Sauvignon 2019,Cabernet Sauvignon,"Mendoza, Argentina",9 99,750 ML,0.0,0 Ratings,
Walsh & Sons Roi Cabernet Sauvignon 2019,Cabernet Sauvignon,"Margaret River, Western Australia, Australia",50,750 ML,0.0,0 Ratings,
Quinta de Chocapalha Arinto 2019,Arinto,Portugal,15 99,750 ML,3.1,5 Ratings,
Patrice Rion Bourgogne Chardonnay 2019,Chardonnay,"Burgundy, France",36 99,750 ML,0.0,0 Ratings,
Giovanni Rosso Serralunga d'Alba Barolo 2017,Nebbiolo,"Alba, Piedmont, Italy",70,750 ML,0.0,0 Ratings,WS 93 RP 92 WE 92 V 92
Chateau Gloria (Futures Pre-Sale) 2020,Bordeaux Red Blends,"St-Julien, Bordeaux, France",41 97,750 ML,0.0,0 Ratings,JS 95 JD 95 WE 95 RP 94 D 92
Chateau Valandraud (Futures Pre-Sale) 2020,Bordeaux Red Blends,"St. Emilion, Bordeaux, France",159 97,750 ML,0.0,0 Ratings,JD 99 JS 98 WE 98 RP 97 D 96
Chateau Calon-Segur (3 Liter Bottle) 2001,Bordeaux Red Blends,"St. Estephe, Bordeaux, France",629 97,3000 ML,0.0,0 Ratings,WS 90 RP 90
Esk Valley Chardonnay 2019,Chardonnay,"Hawkes Bay, New Zealand",22 99,750 ML,0.0,0 Ratings,
Novelty Hill Merlot 2019,Merlot,"Columbia Valley, Washington",22 99,750 ML,0.0,0 Ratings,JS 92
Yalumba The Signature Cabernet/Shiraz 2016,Other Red Blends,"Barossa Valley, Barossa, South Australia, Australia",70,750 ML,4.3,14 Ratings,JS 96 D 96 RP 94 WE 94
Azienda Vitivinicola Antonio Roncolato Amarone della Valpolicella 2015,Other Red Blends,"Valpolicella, Veneto, Italy",44 99,750 ML,0.0,0 Ratings,D 97
Henri Bourgeois Sancerre d'Antan 2018,Sauvignon Blanc,"Sancerre, Loire, France",55 99,750 ML,5.0,15 Ratings,WE 93 RP 93
Chateau Ste. Michelle Indian Wells Red Blend 2018,Other Red Blends,"Columbia Valley, Washington",20,750 ML,0.0,0 Ratings,
Tenuta di Valgiano Rosso 2013,Tuscan Blends,"Tuscany, Italy",89 99,750 ML,0.0,0 Ratings,
Kruger-Rumpf Estate Riesling 2019,Riesling,"Nahe, Germany",21,750 ML,0.0,0 Ratings,JS 91 WW 91
Colgin IX Estate Red 2017,Bordeaux Red Blends,"Napa Valley, California",650,750 ML,0.0,0 Ratings,RP 98 JD 98 JS 97 WS 94
Georg Albrecht Schneider Niersteiner Paterberg Riesling Kabinett 2019,Riesling,"Rheinhessen, Germany",14 99,750 ML,0.0,0 Ratings,
Chateau Canon La Gaffeliere (1.5 Liter Magnum) 2017,Bordeaux Red Blends,"St. Emilion, Bordeaux, France",189 99,1500 ML,0.0,0 Ratings,RP 97 WS 94 WE 94 JS 93 JD 92 D 92
Lewis Cellars Cuvee L 2006,Bordeaux Red Blends,"Napa Valley, California",224 97,750 ML,0.0,0 Ratings,WS 93
Sparkman Birdie Riesling 2017,Riesling,"Columbia Valley, Washington",17 99,750 ML,0.0,0 Ratings,
La Spinetta Moscato Passito Oro (500ML) 2012,Muscat,"Tuscany, Italy",56 99,500 ML,0.0,0 Ratings,
Anakota Helena Dakota Vineyard Cabernet Sauvignon 2018,Cabernet Sauvignon,"Knights Valley, Sonoma County, California",139 99,750 ML,4.6,6 Ratings,RP 99 JD 98 JS 97
Favia Carbone Cabernet Sauvignon 2019,Cabernet Sauvignon,"Napa Valley, California",73 99,750 ML,0.0,0 Ratings,
Rhys Vineyards Alpine Vineyard Pinot Noir 2010,Pinot Noir,"Santa Cruz Mountains, California",119 97,750 ML,0.0,0 Ratings,RP 93 BH 91
Amici Napa Valley Reserve Cabernet Sauvignon 2019,Cabernet Sauvignon,"Napa Valley, California",98 99,750 ML,0.0,0 Ratings,RP 96 JD 96 JS 94
Dusted Valley Stained Tooth Syrah 2018,Syrah/Shiraz,"Columbia Valley, Washington",34 99,750 ML,0.0,0 Ratings,
Keenan Napa Valley Merlot (375ML half-bottle) 2017,Merlot,"Napa Valley, California",19 99,375 ML,0.0,0 Ratings,
Wakefield Estate Clare Valley Shiraz 2018,Syrah/Shiraz,"Clare Valley, South Australia, Australia",16 99,750 ML,0.0,0 Ratings,
Recaredo Terrers Gran Reserva Brut Nature 2015,Vintage Sparkling Wine,Spain,40 99,750 ML,0.0,0 Ratings,RP 93
Siro Pacenti Rosso di Montalcino 2019,Sangiovese,"Montalcino, Tuscany, Italy",39 99,750 ML,0.0,0 Ratings,V 91
Domaine Chaume-Arnaud Cotes du Rhone Le Petit Coquet 2018,Rhone Red Blends,"Cotes du Rhone, Rhone, France",15 99,750 ML,0.0,0 Ratings,
Perez Cruz Limited Edition Cabernet Franc 2020,Cabernet Franc,"Maipo Valley, Chile",21 99,750 ML,0.0,0 Ratings,
Patz & Hall Little Boot Vineyard Pinot Noir 2018,Pinot Noir,"Russian River, Sonoma County, California",79 99,750 ML,0.0,0 Ratings,
Antica Torino Rosso Vermouth,Vermouth,"Piedmont, Italy",28 99,750 ML,0.0,0 Ratings,
Rive Sud Pinot Noir 2019,Pinot Noir,"Pays d’Oc, South of France, France",13 99,750 ML,3.8,15 Ratings,
Y. Rousseau Son of a Butcher 2020,Other Red Blends,"North Coast, California",22 99,750 ML,0.0,0 Ratings,
Gramercy Cellars Lower East Cabernet Sauvignon 2017,Cabernet Sauvignon,"Walla Walla Valley, Columbia Valley, Washington",31 99,750 ML,0.0,0 Ratings,WE 92
Two Hands Ares Shiraz 2015,Syrah/Shiraz,"Barossa Valley, Barossa, South Australia, Australia",189 99,750 ML,0.0,0 Ratings,JD 97 RP 96 WS 94
Haute Couture Rose,Sparkling Rosé,France,25 99,750 ML,4.3,15 Ratings,WW 90
Kruger-Rumpf Munsterer Rheinberg Riesling Kabinett 2019,Riesling,"Nahe, Germany",23 99,750 ML,0.0,0 Ratings,JS 91
Claudia Pearson Wine and Cheese Tea Towel,,,19 99,0 ML,0.0,0 Ratings,
Costers del Priorat Petit Pissarres 2019,Rhone Red Blends,"Priorat, Spain",27,750 ML,0.0,0 Ratings,
Enfield Wine Co Pretty Horses Tempranillo 2019,Tempranillo,California,29 99,750 ML,0.0,0 Ratings,
Lloyd Sta. Rita Hills Pinot Noir 2018,Pinot Noir,"Sta. Rita Hills, Santa Barbara, Central Coast, California",49 99,750 ML,0.0,0 Ratings,
Christian Moreau Chablis 2019,Chardonnay,"Chablis, Burgundy, France",36 99,750 ML,0.0,0 Ratings,JS 93
Domaine Daniel Rion & Fils Nuits-St-Georges Aux Vignes Rondes Premier Cru 2018,Pinot Noir,"Nuits-St-Georges, Cote de Nuits, Cote d'Or, Burgundy, France",82 99,750 ML,0.0,0 Ratings,WS 94 JS 91
Chateau de Fontenille Entre-Deux-Mers Blanc 2019,Bordeaux White Blends,"Entre-Deux-Mers, Bordeaux, France",16 99,750 ML,0.0,0 Ratings,WE 90
Pulenta Estate Sauvignon Blanc 2018,Sauvignon Blanc,"Mendoza, Argentina",19 99,750 ML,3.3,15 Ratings,JS 92
Epiphany Bien Nacido Vineyard Syrah 2016,Syrah/Shiraz,"Santa Maria Valley, Central Coast, California",48 99,750 ML,4.6,9 Ratings,JD 93 W & S 93 WE 91 RP 90
Bindi Sergardi Calidonia Chianti Classico Riserva 2015,Sangiovese,"Chianti Classico, Chianti, Tuscany, Italy",50,750 ML,0.0,0 Ratings,JS 93 WE 90
Bryant Family Bettina Proprietary Red 2013,Bordeaux Red Blends,"Napa Valley, California",399 97,750 ML,0.0,0 Ratings,JS 97 RP 92
Smokescreen Cabernet Sauvignon 2016,Cabernet Sauvignon,"Napa Valley, California",35 99,750 ML,0.0,0 Ratings,
Jacquesson Avize Champ Cain Extra Brut Grand Cru 2009,Vintage Sparkling Wine,"Champagne, France",311,750 ML,0.0,0 Ratings,WE 96 WS 94 W & S 94 D 94
Sean Minor 4B Pinot Noir 2019,Pinot Noir,"Central Coast, California",13 99,750 ML,3.4,8 Ratings,WW 89
Piaggia Carmignano Riserva 2018,Other Red Blends,"Carmignano, Tuscany, Italy",39 99,750 ML,0.0,0 Ratings,V 94
Prosper Maufoux Cremant de Bourgogne Rose,Sparkling Rosé,"Maconnais, Burgundy, France",23,750 ML,0.0,0 Ratings,
Bonterra The McNab Biodynamic Single Vineyard Red 2020,Other Red Blends,"Mendocino, California",58 99,750 ML,0.0,0 Ratings,WW 91
Louis Jadot Bonnes-Mares Grand Cru 2005,Pinot Noir,"Chambolle-Musigny, Cote de Nuits, Cote d'Or, Burgundy, France",649 97,750 ML,0.0,0 Ratings,V 96 RP 95 WS 95 BH 95
Lucien Le Moine Pommard Grands Epenots Premier Cru 2019,Pinot Noir,"Pommard, Cote de Beaune, Cote d'Or, Burgundy, France",159 99,750 ML,0.0,0 Ratings,BH 94
Ben Haines Pinot Noir 2019,Pinot Noir,"Yarra Valley, Victoria, Australia",24 99,750 ML,3.3,12 Ratings,WE 91
Marchand-Tawse Corton Grand Cru 2017,Pinot Noir,"Aloxe-Corton, Cote de Beaune, Cote d'Or, Burgundy, France",139 99,750 ML,0.0,0 Ratings,BH 93
Massey Dacta Sauvignon Blanc 2021,Sauvignon Blanc,"Marlborough, New Zealand",13 99,750 ML,0.0,0 Ratings,
Vineyard 29 Cru Cabernet Sauvignon 2018,Cabernet Sauvignon,"Napa Valley, California",75,750 ML,4.4,13 Ratings,JD 94 WW 93
Skylark Grenache 2014,Grenache,"Mendocino, California",24,750 ML,0.0,0 Ratings,
Sevilen Isabey Sauvignon Blanc 2020,Sauvignon Blanc,Turkey,21 99,750 ML,0.0,0 Ratings,
Domaine Sylvie Esmonin Gevrey-Chambertin Clos Saint-Jacques Premier Cru 2008,Pinot Noir,"Gevrey-Chambertin, Cote de Nuits, Cote d'Or, Burgundy, France",219 97,750 ML,0.0,0 Ratings,
Talbott Sleepy Hollow Chardonnay 2018,Chardonnay,"Santa Lucia Highlands, Monterey, Central Coast, California",32 99,750 ML,0.0,0 Ratings,WE 92 V 92
Quinta do Noval Vintage Port 2015,Port,Portugal,110,750 ML,0.0,0 Ratings,JS 95 RP 95 WE 95 WS 95 JD 95
Andre Robert Rose de Vignes Extra Brut,Sparkling Rosé,"Champagne, France",78 99,750 ML,0.0,0 Ratings,WW 92
Domaine de la Taille Aux Loups Triple Zero,Non-Vintage Sparkling Wine,"Loire, France",32 99,750 ML,3.9,32 Ratings,V 94 W & S 92
Renato Ratti Ochetti Nebbiolo 2019,Nebbiolo,"Piedmont, Italy",25,750 ML,3.7,15 Ratings,RP 91
Schafer-Frohlich Estate Riesling Trocken 2020,Riesling,"Nahe, Germany",29 99,750 ML,0.0,0 Ratings,JS 92
Artazu Pasos de San Martin Garnacha 2016,Grenache,"Navarra, Spain",30,750 ML,3.8,18 Ratings,JS 95 RP 92
Val di Suga Poggio al Granchio Brunello di Montalcino 2013,Sangiovese,"Montalcino, Tuscany, Italy",100,750 ML,0.0,0 Ratings,JS 94 RP 94 W & S 91
EnRoute Winery Brumaire Chardonnay 2020,Chardonnay,"Russian River, Sonoma County, California",50,750 ML,0.0,0 Ratings,WW 92
Royal Prince Slam Dunk Red 2020,Other Red Blends,California,14 99,750 ML,0.0,0 Ratings,
Tessier Filigreen Vineyard Pinot Noir 2017,Pinot Noir,"Anderson Valley, Mendocino, California",60,750 ML,0.0,0 Ratings,WE 93
Viticcio Chianti Classico Riserva 2016,Sangiovese,"Chianti Classico, Chianti, Tuscany, Italy",30 99,750 ML,3.9,60 Ratings,JS 94 WS 93 RP 92
Bernard Faurie Hermitage 2011,Syrah/Shiraz,"Hermitage, Rhone, France",229 97,750 ML,0.0,0 Ratings,
Vignerons de Saumur Bourgueil Lieu-Dit Beauregard 2019,Cabernet Franc,"Bourgueil, Touraine, Loire, France",18 99,750 ML,0.0,0 Ratings,
Bennett Valley Cellars Bin 6410 Pinot Noir 2019,Pinot Noir,"Sonoma County, California",23 99,750 ML,0.0,0 Ratings,
Lange Winery Classique Chardonnay 2020,Chardonnay,"Willamette Valley, Oregon",18 99,750 ML,0.0,0 Ratings,JS 91
Araujo Eisele Vineyard Cabernet Sauvignon 1999,Cabernet Sauvignon,"Napa Valley, California",359 97,750 ML,0.0,0 Ratings,WS 97 RP 95
Sleight Of Hand The Conjurer Red 2019,Bordeaux Red Blends,"Columbia Valley, Washington",39 99,750 ML,0.0,0 Ratings,JS 91 JD 90
Scott Family Estate Carneros Chardonnay 2017,Chardonnay,"Carneros, California",41 99,750 ML,0.0,0 Ratings,
Chateau Pavie (1.5 Liter Magnum) 2016,Bordeaux Red Blends,"St. Emilion, Bordeaux, France",959 99,1500 ML,0.0,0 Ratings,JS 100 RP 100 JD 99 WS 97 WE 96
Maison Brotte Charles Brotte Grand Vallon Syrah 2020,Syrah/Shiraz,"Vin de France, France",10 99,750 ML,4.4,47 Ratings,WW 88
Colle dei Bardellini Vermentino 2019,Vermentino,"Riviera Ligure di Ponente, Liguria, Italy",27 99,750 ML,4.1,9 Ratings,
Brown Estate Chaos Theory 2019,Other Red Blends,"Napa Valley, California",39 99,750 ML,4.4,25 Ratings,
Hiedler Loss Gruner Veltliner 2020,Gruner Veltliner,"Kamptal, Austria",21 99,750 ML,3.6,5 Ratings,JS 90
Dow's Fine White Port,Port,Portugal,15 99,750 ML,3.8,32 Ratings,
D.R. Stephens Estate DRII Cabernet Sauvignon (torn label) 2014,Cabernet Sauvignon,"Napa Valley, California",99 97,750 ML,0.0,0 Ratings,
M. Chapoutier Ermitage l'Ermite 2016,Syrah/Shiraz,"Hermitage, Rhone, France",519 97,750 ML,0.0,0 Ratings,
Domaine Nerantzi Koniaros 2015,Other Red Wine,"Macedonia, Greece",64 99,750 ML,0.0,0 Ratings,
FEL Anderson Valley Pinot Gris 2019,Pinot Gris/Grigio,"Anderson Valley, Mendocino, California",24 99,750 ML,3.9,8 Ratings,WE 92
Patrick Piuze Bourgogne Tonnerre Les Boutots 2019,Chardonnay,"Burgundy, France",38 99,750 ML,0.0,0 Ratings,
Domaine Pinson Freres Chablis La Foret Premier Cru 2019,Chardonnay,"Burgundy, France",46 99,750 ML,0.0,0 Ratings,WE 94
Pierre Sparr Pinot Blanc 2019,Pinot Blanc,"Alsace, France",17 99,750 ML,3.8,11 Ratings,
Lange Winery Willamette Valley Pinot Noir 2021,Pinot Noir,"Willamette Valley, Oregon",31 99,750 ML,0.0,0 Ratings,
Ashes & Diamonds Blanc No. 4 2018,Bordeaux White Blends,"Napa Valley, California",44 99,750 ML,0.0,0 Ratings,
Argyros Santorini Estate Assyrtiko 2020,Assyrtiko,"Santorini, Greece",43 99,750 ML,0.0,0 Ratings,
Dog Point Vineyard Section 94 Sauvignon Blanc 2018,Sauvignon Blanc,"Marlborough, New Zealand",36 99,750 ML,2.4,8 Ratings,JS 94
Avennia Sestina 2017,Bordeaux Red Blends,"Columbia Valley, Washington",74 99,750 ML,0.0,0 Ratings,JD 95 W & S 94 RP 94 WE 91
Rene Rostaing Cote-Rotie Cote Blonde (stained label) 1994,Rhone Red Blends,"Cote Rotie, Rhone, France",239 97,750 ML,0.0,0 Ratings,RP 94
Westwood Winery Sonoma County Pinot Noir 2017,Pinot Noir,"Sonoma County, California",48,750 ML,4.2,5 Ratings,TP 94 JD 93 WE 90
Moone-Tsai Chardonnay 2018,Chardonnay,"Napa Valley, California",78 99,750 ML,0.0,0 Ratings,RP 93
Stark-Conde Stellenbosch Cabernet Sauvignon 2018,Cabernet Sauvignon,South Africa,28,750 ML,0.0,0 Ratings,W & S 90
Kendall-Jackson Vintner's Reserve Chardonnay 2019,Chardonnay,California,17,750 ML,4.0,272 Ratings,WE 92 WW 91
Zuccardi Tito Zuccardi 2017,Other Red Blends,"Uco Valley, Mendoza, Argentina",37 99,750 ML,3.5,12 Ratings,RP 93 JS 93
Chateau de Saint Cosme Saint-Joseph 2019,Syrah/Shiraz,"Saint-Joseph, Rhone, France",39 99,750 ML,4.0,10 Ratings,W & S 95 JD 93 WS 93 RP 92
Domaine du Seminaire Cotes du Rhone 2020,Rhone Red Blends,"Cotes du Rhone, Rhone, France",18 99,750 ML,0.0,0 Ratings,
Myriad Cellars Beckstoffer Dr. Crane Cabernet Sauvigon (scuffed labels) 2011,Cabernet Sauvignon,"St. Helena, Napa Valley, California",199 97,750 ML,0.0,0 Ratings,RP 90
Amici Olema Reserve Chardonnay 2020,Chardonnay,"Sonoma County, California",19 99,750 ML,0.0,0 Ratings,
Turnbull Leopoldina Vineyard Cabernet Sauvignon 2014,Cabernet Sauvignon,"Oakville, Napa Valley, California",189 97,750 ML,0.0,0 Ratings,
Grgich Hills Estate Yountville Old Vine Cabernet Sauvignon 2013,Cabernet Sauvignon,"Yountville, Napa Valley, California",179 99,750 ML,0.0,0 Ratings,RP 95 WE 94 W & S 91
WildAire Timothy Pinot Noir 2016,Pinot Noir,"Willamette Valley, Oregon",33 99,750 ML,0.0,0 Ratings,
Darms Lane Fortune 1621 Cabernet Sauvignon 2018,Cabernet Sauvignon,"Napa Valley, California",31 99,750 ML,0.0,0 Ratings,
Vino Noceto Sangiovese Rosato 2020,Rosé,"Amador, Sierra Foothills, California",23 99,750 ML,0.0,0 Ratings,
Haras de Pirque Albis 2016,Bordeaux Red Blends,"Maipo Valley, Chile",52 99,750 ML,3.8,8 Ratings,WS 93 JS 92 WE 91 D 90
Chateau des Laurets Baron Puissgeuin Saint-Emilion 2015,Bordeaux Red Blends,"Bordeaux, France",84 99,750 ML,0.0,0 Ratings,JS 92 WE 92 RP 90
Marchesi di Gresy Langhe Sauvignon 2019,Sauvignon Blanc,"Piedmont, Italy",22 99,750 ML,0.0,0 Ratings,RP 90
Conceito Legítimo Tinto 2018,Other Red Blends,"Douro, Portugal",24 99,750 ML,4.5,16 Ratings,
Kathryn Kennedy Santa Cruz Mountains Estate Cabernet Sauvignon 2016,Cabernet Sauvignon,"Santa Cruz Mountains, California",299 97,750 ML,0.0,0 Ratings,
Weinkeller Von Erbach Rheingau Riesling (1 Liter) 2020,Riesling,"Rheingau, Germany",19 99,1000 ML,0.0,0 Ratings,
Fingers Crossed Faethm Syrah 2019,Syrah/Shiraz,"Central Coast, California",399 97,750 ML,0.0,0 Ratings,
Azelia Barolo Margheria 2017,Nebbiolo,"Serralunga d'Alba, Piedmont, Italy",110,750 ML,0.0,0 Ratings,JS 96 V 94 WE 93 RP 93 JD 93 WS 90
Zuccardi Emma Bonarda 2018,Bonarda,"Uco Valley, Mendoza, Argentina",34 99,750 ML,0.0,0 Ratings,RP 93
Finca Valpiedra Reserva 2012,Tempranillo,"Rioja, Spain",44 99,750 ML,0.0,0 Ratings,V 92 RP 91
Val de Mer by Patrick Piuze Cremant De Bourgogne Non Dose,Non-Vintage Sparkling Wine,"Chablis, Burgundy, France",26 99,750 ML,3.8,15 Ratings,
Jacques Prieur Clos Vougeot 2014,Pinot Noir,"Burgundy, France",249 97,750 ML,0.0,0 Ratings,
Wrath San Saba Pinot Noir 2019,Pinot Noir,"Monterey, Central Coast, California",43 99,750 ML,0.0,0 Ratings,WS 92
Alphonse Mellot La Moussiere Sancerre Rose 2020,Rosé,"Sancerre, Loire, France",39 99,750 ML,0.0,0 Ratings,
Talley Rosemary's Vineyard Chardonnay 2019,Chardonnay,"Arroyo Grande Valley, Central Coast, California",65,750 ML,0.0,0 Ratings,JD 94 WE 93 W & S 92 CG 91
Philippe Tessier Pont du Jour Cheverny 2019,Other Red Blends,"Loire, France",31 99,750 ML,0.0,0 Ratings,
Zephyr Pinot Noir 2020,Pinot Noir,"Marlborough, New Zealand",21 99,750 ML,0.0,0 Ratings,
Badia a Coltibuono Cultusboni RS Chianti Classico 2019,Sangiovese,"Chianti Classico, Chianti, Tuscany, Italy",16 99,750 ML,0.0,0 Ratings,V 92
Mohua Sauvignon Blanc 2020,Sauvignon Blanc,"Marlborough, New Zealand",12 99,750 ML,4.2,19 Ratings,WW 89
Aura di Valerie Zaffiro 2019,Tuscan Blends,"Tuscany, Italy",47 99,750 ML,0.0,0 Ratings,
Gruet Demi-Sec,Non-Vintage Sparkling Wine,"New Mexico, Other U.S.",19,750 ML,3.8,16 Ratings,
Lamberti Organic Prosecco,Non-Vintage Sparkling Wine,"Prosecco, Italy",17 99,750 ML,0.0,0 Ratings,
Carpineto Brunello di Montalcino 2015,Sangiovese,"Montalcino, Tuscany, Italy",64 99,750 ML,4.9,7 Ratings,WS 95 RP 92 D 91
OVID Hexameter 2016,Bordeaux Red Blends,"Napa Valley, California",324 99,750 ML,0.0,0 Ratings,JD 99 RP 98 WS 94
Domaine des Lambrays Clos Des Lambrays Grand Cru (1.5 Liter Magnum) 2019,Pinot Noir,"Morey-St-Denis, Cote de Nuits, Cote d'Or, Burgundy, France","1,199 97",1500 ML,0.0,0 Ratings,D 98 JM 97 RP 95
Spring Valley Frederick Estate Red 2016,Bordeaux Red Blends,"Walla Walla Valley, Columbia Valley, Washington",50 99,750 ML,0.0,0 Ratings,JS 91 WE 90
Melka Metisse Jumping Goat Vineyard 2017,Bordeaux Red Blends,"Napa Valley, California",229 99,750 ML,0.0,0 Ratings,JS 97
Vineyard 29 Aida Estate Zinfandel 2018,Zinfandel,"Napa Valley, California",94 99,750 ML,0.0,0 Ratings,RP 92 JD 91
Balletto Winery Teresa's Unoaked Chardonnay 2021,Chardonnay,"Russian River, Sonoma County, California",22 99,750 ML,0.0,0 Ratings,WW 91
Matthieu Barret Petit Ours Cotes du Rhone 2020,Syrah/Shiraz,"Cotes du Rhone, Rhone, France",25 99,750 ML,3.7,8 Ratings,JS 91
AVA Grace Chardonnay 2020,Chardonnay,California,8 99,750 ML,0.0,0 Ratings,
Domaines Paul Mas Reserve Malbec 2018,Malbec,"Pays d’Oc, South of France, France",14 99,750 ML,0.0,0 Ratings,
Ojai McGinley Vineyard Sauvignon Blanc 2021,Sauvignon Blanc,"Santa Ynez Valley, Santa Barbara, Central Coast, California",28 99,750 ML,0.0,0 Ratings,WW 91
Sine Qua Non Five Shooter Syrah 2010,Syrah/Shiraz,California,429 97,750 ML,0.0,0 Ratings,RP 98
Andrew Murray Roasted Slope Syrah 2019,Syrah/Shiraz,"Santa Barbara, Central Coast, California",54 99,750 ML,0.0,0 Ratings,V 94
Chateau Pichon-Longueville Baron (6-Pack OWC Futures Pre-Sale) 2020,Bordeaux Red Blends,"Pauillac, Bordeaux, France",989 97,750 ML,0.0,0 Ratings,JS 98 JD 98 RP 97 D 96
Costers del Priorat Blanc de Pissarres 2019,Other White Blends,"Priorat, Spain",36 99,750 ML,0.0,0 Ratings,
Rudd Sauvignon Blanc 2020,Sauvignon Blanc,"Mt. Veeder, Napa Valley, California",99 99,750 ML,0.0,0 Ratings,
Guillaume Gonnet Chateauneuf du Pape Bel Ami 2019,Rhone Red Blends,"Chateauneuf-du-Pape, Rhone, France",45,750 ML,0.0,0 Ratings,WS 93
Skylark Las Aves 2016,Other Red Blends,"North Coast, California",30 99,750 ML,0.0,0 Ratings,W & S 92 JD 90
William Knuttel Windsor Oaks Vineyard Chalk Hill Chardonnay 2018,Chardonnay,"Chalk Hill, Sonoma County, California",42,750 ML,0.0,0 Ratings,
Chateau Figeac 2010,Bordeaux Red Blends,"St. Emilion, Bordeaux, France",279 99,750 ML,0.0,0 Ratings,JS 98 RP 97 V 97 WE 96 WS 96 D 96
Zestos Blanco 2020,Other White Wine,"Vinos de Madrid, Spain",13 99,750 ML,0.0,0 Ratings,WW 90
Buena Vista North Coast Pinot Noir 2018,Pinot Noir,"North Coast, California",15 99,750 ML,4.0,7 Ratings,WE 91
Albert Bichot Chassagne-Montrachet 2018,Chardonnay,"Chassagne-Montrachet, Cote de Beaune, Cote d'Or, Burgundy, France",99 99,750 ML,0.0,0 Ratings,WE 92 WS 91
San Felice Il Grigio Chianti Classico Riserva 2018,Sangiovese,"Chianti Classico, Chianti, Tuscany, Italy",27,750 ML,3.6,17 Ratings,JS 93 V 90
Valdivieso Sparkling Brut,Non-Vintage Sparkling Wine,"Colchagua Valley, Rapel Valley, Chile",14 99,750 ML,0.0,0 Ratings,
Rancho Sisquoc Pinot Noir 2019,Pinot Noir,"Santa Barbara, Central Coast, California",21 99,750 ML,0.0,0 Ratings,WE 94
Self-Standing Winged Corkscrew,,,26 99,0 ML,0.0,0 Ratings,
Merus Cabernet Sauvignon 2004,Cabernet Sauvignon,"Napa Valley, California",169 97,750 ML,0.0,0 Ratings,
Encostas do Lima Vinho Verde 2020,Other White Blends,"Vinho Verde, Portugal",12 99,750 ML,0.0,0 Ratings,
Tyler Winery Dierberg Chardonnay 2015,Chardonnay,"Santa Maria Valley, Central Coast, California",50,750 ML,0.0,0 Ratings,RP 90
Pikes Hills and Valleys Riesling 2019,Riesling,"Clare Valley, South Australia, Australia",17 99,750 ML,3.8,42 Ratings,RP 91 WE 91
Barrett & Barrett Cabernet Sauvignon (1.5L Magnum) 2009,Cabernet Sauvignon,"Napa Valley, California",629 97,1500 ML,0.0,0 Ratings,V 95 WS 92
Ferraton Pere & Fils Cotes du Rhone Samorens 2019,Grenache,"Cotes du Rhone, Rhone, France",16 99,750 ML,0.0,0 Ratings,JD 89
Bigonneau Reuilly Blanc 2020,Sauvignon Blanc,"Reuilly, Loire, France",21 99,750 ML,0.0,0 Ratings,
Piper-Heidsieck Brut Vintage Rare 2008,Vintage Sparkling Wine,"Champagne, France",250,750 ML,4.9,5 Ratings,WS 97 WE 96 RP 93
Altos las Hormigas Colonia Las Liebres Bonarda 2020,Bonarda,Argentina,9 99,750 ML,3.6,34 Ratings,RP 90
Chateau de Coulaine Chinon 2020,Cabernet Franc,"Chinon, Touraine, Loire, France",22 99,750 ML,0.0,0 Ratings,
Tomas Cusine Auzells 2016,Other White Blends,"Costers del Segre, Spain",18 98,500 ML,0.0,0 Ratings,
The Better Half Sauvignon Blanc 2021,Sauvignon Blanc,"Marlborough, New Zealand",16,750 ML,3.5,10 Ratings,TP 91 JS 90
Faiveley Gevrey-Chambertin Lavaux St-Jacques Premier Cru 2019,Pinot Noir,"Gevrey-Chambertin, Cote de Nuits, Cote d'Or, Burgundy, France",229 99,750 ML,0.0,0 Ratings,JS 96 D 94
Rocca di Montegrossi Chianti Classico 2019,Sangiovese,"Chianti Classico, Chianti, Tuscany, Italy",26 99,750 ML,0.0,0 Ratings,JS 92 V 91
Castellare Chianti Classico 2020,Sangiovese,"Chianti Classico, Chianti, Tuscany, Italy",24 99,750 ML,3.9,5 Ratings,
Roth Estate Alexander Valley Cabernet Sauvignon 2019,Cabernet Sauvignon,"Alexander Valley, Sonoma County, California",24 99,750 ML,0.0,0 Ratings,WW 89
Tensley Fundamental Cabernet Sauvignon 2020,Cabernet Sauvignon,"Central Coast, California",19 99,750 ML,0.0,0 Ratings,
Catena Zapata Adrianna White Bones Chardonnay 2016,Chardonnay,"Mendoza, Argentina",139 99,750 ML,0.0,0 Ratings,
FEL Savoy Vineyard Pinot Noir 2018,Pinot Noir,"Anderson Valley, Mendocino, California",69 99,750 ML,3.8,5 Ratings,WE 94 WS 90
Evodia Old Vine Garnacha 2019,Grenache,"Calatayud, Spain",14,750 ML,3.7,260 Ratings,JD 93 RP 90
90 Point Steak Lover's Wine Gift Set,,,66,750 ML,0.0,0 Ratings,
McBride Sisters Black Girl Magic Red Blend 2019,Bordeaux Red Blends,California,27 99,750 ML,3.9,23 Ratings,
